	text	labels
1500	not everyone carry excess fat the same way though. that part at least is geenuhteeks.	IMP
1501	TVTropes is autistic as fuck. Don't bother.	EXP
1502	Not me but this guy at my old church in my youth group was caught by my youth pastor having sex with a random non church going girl behind the church one day . The youth pastor talked to him about it and the dude had the balls to keep coming back to church and all other meetings like bible study and act like nothing ever happened and then ask out my little sister . Oh   HELL NO   . Few people knew about it despite it being a small church . This was back when my parents dragged me to church , which obviously was a great experience . (  sarcasm  )	NOT
1503	If you need me, I'll be mixing up a screwdriver.	IMP
1504	We are the smarter , more conservative 4chan ' s older brother .	NOT
1505	The last one is actually pretty accurate if she was portraying American Tifa. If Shinra was in America, you'd be seeing meth'd out trailer trash chicks like that everywhere.	EXP
1506	you reap what you sow I guess she indeed became a sow	IMP
1507	"I have frozen synapse , I have SC2 , I love SC2 , I have loads of - NUMBER - NUMBER - NUMBER % off random crap , I have NUMBER coal , I suck at unlocking new gifts , I love DoTA so , so much ( the one i want :P ) , I am drunk and tired so cant think of anything incredibly witty to do with SC2 , I am going to bed now , perhaps "" probe rush "" is hilarious enough :D"	NOT
1508	Of course the fatty better be giving it's husband constant blowjobs during this time. She better not, that sounds like torture for the poor guy :/	IMP
1509	Cram jam Chink fuck trade truck World War NUMBER Super World Peace Agreement Absolute Addiction Alzheimer's	EXP
1510	URL URL URL	NOT
1511	Flawless timing . Thank you .	NOT
1512	I fail to see how being fit = good health is groundbreaking news, especially to this sub.	IMP
1513	The monitoring bracelet is most likely because he got caught stealing food.	IMP
1514	So she SHOULDNT go to jail ? Are you saying the choice is either to send everyone to jail or nobody ?	NOT
1515	Its obviously omec from legends of the hidden temple .	NOT
1516	Hold up, my parents taught me TERRIBLE habits and it was VERY hard to get away from that mentality. It took me years...	IMP
1517	That makes complete sense . Thanks ! :)	NOT
1518	"""Growing"" movement is right."	IMP
1519	zombiebuffet is hot  and real  raskeeke isn't a very good ' breast analysis ' or a very nice person .	NOT
1520	Funny guy . ^	NOT
1521	Uhm . NUMBER ( e ) inserted on Dec 15th ( IIRC ) specifically addresses ... Sigh , nevermind .	NOT
1522	She said she was doing keto.  Maybe she just sucks at math.	IMP
1523	The primary cause of overfishing	IMP
1524	That is literally the ugliest thing I have ever seen.	IMP
1525	These posts have their own sub-reddit now , lets keep them there .	NOT
1526	This stupid fat piece of shit can't even be bothered to create its own meme.	EXP
1527	Indeed it is .	NOT
1528	Or it's arteries stop from all the cholesterol.	IMP
1529	What if that's a lie ? !	NOT
1530	I found a pic of Abby when she was [young](URL	IMP
1531	This guy is using both arms to hold the TV . Who took the picture ?	NOT
1532	I think he's just scared of her as weird as that sounds. ..the delusion was strong as fuck with that ham	EXP
1533	High school athletes. Have a diet of pure garbage, but a strict exercise schedule, once they graduate, they ditch the exercise and keep the diet.	IMP
1534	... in ocean on an organic spaceship flying through the universe with all the other talking monkeys .	NOT
1535	I don't get why they say it's offensive to fat people, that's literally just a photo with a description. Do they say these women are stupid,without OP implying it?	EXP
1536	"Seems kind of high-minded to assume you know what God is thinking . I think any being capable of creating a universe is probably a bit more morally evolved than to say , "" Oh , he doesn't like me ? To hell with him ! "" Telling a person that their individual path to spiritual enlightenment is wrong causes stagnation of our culture and condemns mankind to a slow , lonesome death ."	NOT
1537	You got to be fucking kidding me...	EXP
1538	"I hate his ""comedy"" and I'm not sure if that's because he's a shitty comedian or because I can't like something produced by someone so disgusting."	EXP
1539	Oh . Sorry . Busy being busy ... I just appreciate when others link to claims if and when possible . But if you will not generously share a link you may have recently read , then I will go find it ...	NOT
1540	Sounds like a porno i want to watch.	IMP
1541	Your submission was removed for the following reason(s): - It is off topic and/or does not contain any direct fat hate.   /r/ FPHDiscussion If you feel this removal was in error, please [message the moderators](URL	IMP
1542	"I can imagine the reply to you being ""I bet you have a miserable unhappy life"". They don't even try argue back to defend their absolute shite logic because deep down in their squashed body then know what there saying is absurd and just want attention."	EXP
1543	Will check that out thanks !	NOT
1544	THANK YOU.  My wife and I can make a large cheat meal and a snack the next day out of a large pizza...no way this hamburglar is eating two slices and calling it quits.	EXP
1545	I would be disgusted if I looked in the mirror and saw that.	IMP
1546	Seriously , it's a copyright , you can't copy write something , and therefore you can't have copy written something either . Did you finish high school ?	NOT
1547	This fat un-grateful fuck. They're trying to save his miserable life and he just says that it's not his problem that they're paying for his fat ass not to die?	EXP
1548	FAT FUCKING BITCH CUNT. I hope she dies of multiple heart attacks, simultaneously choking, while someone force feeds her Crisco.	IMP
1549	So shouldn't the subreddit change to instead /r/hatelazypeople if that's what you fundamentally hate? Are you saying by default, overweight people are lazy?	EXP
1550	Alone here , a thousand kilometres away from my friends , family and girlfriend . Give me a dozen reds .	NOT
1551	Now give me the vinegar ! Yeah I've done this NUMBER times already .	NOT
1552	Holy shit, that's insane!	EXP
1553	There's no such thing . Good sex is what feels good to you and your partner and makes you both feel happy and comfortable . For some people , this is porn-like sex ; for some , it's something totally different . Comparing your IRL sex to porn is a lot like refusing to date any woman who doesn't look like Carmen Electra : unrealistic , exhausting , and ultimately unfulfilling .	NOT
1554	But don't we deserve the chance to smugly laugh at their pathetic attempt to appeal to our better nature too?	EXP
1555	Not in good old Murica they aren't.	IMP
1556	Casting anything other brings it down , so there's still some practicality there .	NOT
1557	"What I find really weird is they use ""death fat"" to refer to each other..."	EXP
1558	and , I have no idea who the fuck any of them are . . . .	NOT
1559	We have no such strict rules . This is not a cult .	NOT
1560	"Reminds me of the nuts who ""declare war"" on Encyclopedia Dramatica and think they are genuinely going to succeed. FPH will be here long after you are six feet under in your reinforced bomb-shelter-of-a-coffin, tubby."	EXP
1561	I've always thought that but I was just unsure really!	IMP
1562	Couldn't bring myself to look at it long enough to decide	IMP
1563	This is fucking hilarious!	EXP
1564	Congratulations ! Herblore is my favourite skill . It's a shame it's so expensive nowadays to train .	NOT
1565	No thank you	NOT
1566	Your post has been removed:  Video game lol. Not enough fat hate.	IMP
1567	tldnr: i'm fat because of god.	IMP
1568	Brb, making a tumblr account.	IMP
1569	Thank you  I honestly don't have much faith in the samples - - I registered for a bunch before he was even born and I have yet to see any of them . Hopefully these will work , though 	NOT
1570	There goes my boner for the rest of the week.	EXP
1571	I found that the worst contact I had ever had with one of those things was sitting on the bus next to one. Got off the bus at a stop after mine because the sack of shit couldn't get out of my way in time, and realised that there were sweat marks from his rolls on my arm and shirt.	EXP
1572	Not op but For me it's just stretchmarks only I can see and slightly smaller boobs	IMP
1573	Upvote for truth . Whenever I have a shower with my gf it's the same ... my normal water temperature feels like ice to her , and her normal temperature feels like lava that will burn off my skin . Women are supposed to have a higher pain tolerance , but you're not having hot showers because of the pain , right ? Right ? What is the science behind this ? & NUMBER ;\ _ & NUMBER ;	NOT
1574	3rd place me ? as unlikely as that is ...	NOT
1575	The wire stole bubbles ?	NOT
1576	"I'm not "" picturing "" Ron Paul or basing my views on news sound bites . I've both read and listened to his views and arguments . I did that because some of his positions I very much agree with and I seriously considered his candidacy before forming my opinion . My position is that I can't in good conscience endorse a candidate for our highest office because some of his ideas are good , but a few have the potential to seriously destabilize our entire way of life ... and we're not talking piddling issues here . Look , I grew up during the cold war era ... I want a relatively reliable president who will keep a cool head in an emergency and be a good decision-maker who considers the well being of our nation as a whole . I could care less if he's a friggin genius but in this era he'd better be above average smart because the consequences of electing a screw-up will be devastating this time around and there isn't a single tea party candidate that fits the bill ... not even close . You like the idea of getting rid of the federal government , the current monetary system , and deregulating just about everything ; except you want to regulate religion , birth control , abortion , and you're keen to give the wealthy absolute control over our collective fates . No thanks ."	NOT
1577	I could get you poker night at the inventory and some coal for dungeon defenders . Sound good ?	NOT
1578	OP missed the joke. OP is super dumb.	EXP
1579	To answer your question: Cheeseburgeroidosis in combination with Aflredosauce Syndrom	IMP
1580	"Whenever I see her say she's a model all I can think is: ""that's not how it works; that's not how any of this works."""	IMP
1581	can confirm cat genetics	IMP
1582	You lucky sonofa ...	NOT
1583	How retarded . . .	NOT
1584	if you can't beat em , confuse em ... =]	NOT
1585	Followed. I'm going to enjoy this.	IMP
1586	cool story bro.	IMP
1587	Skin disease, or did she roll around in fiberglass insulation before taking the photo? Totally disgusting, inside and out, as per usual with this types.	EXP
1588	I'm with you . I do my best to avoid killing any insect and understand that awareness is relative , but to project the idea of prolonged abuse , pain , or agony occurring in such simple organisms is a bit impudent in my opinion .	NOT
1589	I like the video where the American staff eat Australian food and yet not one of them knows you don't eat a fucking spoonful of Vegemite.	EXP
1590	How do you know all that?	IMP
1591	MRW means what?	IMP
1592	Forever alone with Vette ... :\ I guess I'll go find Jack in Mass Effect NUMBER	NOT
1593	I'm not sure they could wipe the front let alone the back. Excuse me while I go vomit.	EXP
1594	I am misreading this or are you saying that sexism is okay as long as it's an accident and you don't really hate women ? That's ridiculous . It's even scarier to me that people are can and do perpetuate sexism without even trying .	NOT
1595	Most excellent point .	NOT
1596	Well at some point a parachute is no longer capable of being used for skydiving so, that'd be my guess	IMP
1597	whoa what the fuck the first NUMBER pictures and then BAM hamplanet thats actually kind of impressive	EXP
1598	Looks like this could be a bad taste party, only that she dressed up as herself.	IMP
1599	"Every time a fat, gurgling planet declares itself a ""health nut"" or a ""fitness junkie"" I scream internally. It's infuriating to see these disgusting piles of lard try to wear labels they didn't even try to earn."	EXP
1600	Seriously wtf that shit is depressing.	EXP
1601	Number NUMBER hits home the most. Never have I ever felt more welcome in any other part of reddit.	IMP
1602	More proof hams are a seperate species: No sexual dimorphism. They must find their mates using whalesong, how sad.	IMP
1603	I mean the OP is kinda wrong, some people are just single because they haven't found someone they want to be with, but HAMS are single because they're fat disgusting pigs	EXP
1604	yeah, the haricut looks much better	IMP
1605	"One of my dear friends was a CNA for five years (she's an RN now) and she says, ""eh, once you've wiped one ass, you've wiped them all!"" I dunno, I don't think I'm that tough."	EXP
1606	Thin privilege is not constantly having the look of sheer and utter exhaustion and exasperation on your face even while in a wheelchair.	EXP
1607	What the fucking fuck , dude ?	NOT
1608	What? She gets right in their.	IMP
1609	I used to be a shrine maiden like you . Then I took a bullet in the hitbox .	NOT
1610	I googled searched it and it's British slang for like woman.	IMP
1611	"But the majority of people in the UK who give their kids stupid names are illiterate. Did you see Harry Enfield's take on it when Wayne Slob got ""Nomio"" Campbell pregnant, Waynetta got her ""braaaan"" baby and named it Canoe after Keanu Reeves, it was spot on."	EXP
1612	"Sign her body is giving up and saying ""fuck you"". Soon her heart and knee will give up too"	EXP
1613	I second .	NOT
1614	"I have a bangin' friend that's NUMBER'NUMBER"" NUMBER lbs and wears a 32DD but has hands like a fat toddler. Shit's weird."	EXP
1615	One is a repulsive parasite, and the other is a lamprey.	EXP
1616	Same here . I take a yearly pilgrimage to the mall and make it a point stand in the doorway for a second , sniff , and keep going . Employees probably think I'm weird as fuck .	NOT
1617	When Marilyn Wann made her scale.	IMP
1618	> Its funny how we only notice when people are extremely nice or extremely rude . All the in between we couldn't care less . Eh , it makes pretty good sense , I think . Think about how much mental processing power it would take to take note of  everyone  you share public spaces with .	NOT
1619	"Asexuality isn't just black and white , like lots of things . Asexual , except when it comes to fantasies , where you are bisexual ? I think you fit in the "" Grey-A "" category . URL"	NOT
1620	[Quebec's](URL	IMP
1621	Yea the super fat annoying chick who gave the black guy his dick injections ... And then took the black guy's dick injections.	IMP
1622	Holy /r/trashy, much?	IMP
1623	Here is [ mine :] ( URL	NOT
1624	[I made two!](URL	IMP
1625	An Argentinian gem called NUMBER Copas	NOT
1626	This is just viral marketing for Bud's Obese Coffins and Shipping Crate Emporium	IMP
1627	Her head literally looks like a thumb	IMP
1628	This is the kind of scumbag piece of shit hunter that only hunts for the kill. He'll drive out there, sit in his car until a deer gets within range, put a bullet (probably a gutshot, never a quick death with inaccuracy) into it, then drive off leaving it there, patting himself on the back for what a skilled guy he is.	EXP
1629	The quote-------                         you	IMP
1630	All the silly little comments made that just sit at NUMBER because your upvote automatically applies and no one else gives a shit get downvoted to zero. Once I saw the first page of them I kept scrolling and found a ton of them like that.	EXP
1631	..if you keep up with her she exercises all the time.. they're defending this lard behemoth on the strenh of her stating online that she's exercised.  Good job people don't tell lies on the internet.	IMP
1632	What am I looking at?	IMP
1633	"This way they can prove they're better than those hambeasts who are not ""working on it"". Reminds me of the fattiest at r/fatpeoplestories"	IMP
1634	Donuts for the office every day.  If they tell me I have to watch what he eats, I don't know how I will eat that shit sandwich.	EXP
1635	What solution is it ? If there's an MSDS available , I might be able to say if they are in OSHA violation .	NOT
1636	Which horror movie is this from?	IMP
1637	URL	IMP
1638	Ouch , NUMBER ? In a row ? Toshiba tends to get a pretty good rating .	NOT
1639	I fucking hate the Fords, even if they're thin they'll still be assholes. Stupid Etobicokians.	EXP
1640	Maybe he worked on it for a long time , but only doing so while drunk . Just throwin it out there .	NOT
1641	Why didn't you play the christian women have to obey men card ? And if you've alread been in her holy of holies , it's not like she would have had a choice . It's either marriage or a stoning .	NOT
1642	the one in the orange has the most disgusting camel toe I've ever seen	EXP
1643	"""Union Worker"" What the hell kind of ""Work"" is this guy capable of? Do they need quality control of the Airport Donuts?"	IMP
1644	That fat bitch would know that the gums didn't have sugar in them though.	EXP
1645	So.. uh.... What's SRD?	IMP
1646	No problem at all , i'll friend you on here and let you know . Also if she's already not apart of it , there is a lot of us on twitter and quite a few people always in the ' know ' about new drugs coming onto the market :) lots of support too for relatives and friends of those with lupus . Happy New Years !	NOT
1647	It looks like he's so fat he's warping reality....	IMP
1648	The only way for a ham to get a hot husband is to become a dependapotamus.	EXP
1649	.	IMP
1650	That's why the Chinese wait until the chick fetus is almost fully formed before eating them . They boil the egg , crack it , and nom on some dead chicken fetus w / salt and soy sauce .	NOT
1651	.. back in NUMBER .	NOT
1652	Assemble the harpoons shitteam!	IMP
1653	NUMBER anti-anti-whites	NOT
1654	Maybe she's lying through her fucking teeth? Or maybe her workouts are typical hamplanet workouts where you mostly play with your phone while walking NUMBER minutes on the treadmill and then going out to reward yourself with a ton of junk food.	EXP
1655	Ugh, why even bother getting its feet washed when its gonna wafflestomp its shit in the shower NUMBER hours later?	EXP
1656	Then he needs to stand the fuck up and scream about how shitty it is . He needs to grow some fucking balls and tell the American people that Congress is fucking them . He needs to be blunt and forceful . No namby pamby political rhetoric .	NOT
1657	It's total bullshit.	EXP
1658	Is this that girl from biggest loser?	IMP
1659	Nope. I don't think the Sun cares either.	IMP
1660	You shit lord, she said she ate healthy in the program; she can't help her genetics!	EXP
1661	So right I have to upvote it twice	IMP
1662	so many windows to cloud with glue  good luck 	NOT
1663	I do know one of them did an AMA on /r/TumblrinAction several months ago. She was generally SJW though not just FA so most of the questions were about third wave SJW femmnizm	EXP
1664	So this ham NUMBER... do people actually go around telling other people that they smell good?	EXP
1665	Shulgin's on the list for sure . Probably Alexander Hoffman . Bill Hicks for sure . Allen Ginsberg . Aldous Huxley . HST has just a bit too much machismo for me . ( edit : Had to google Bob Black , but he sounds like a man after my own heart . )	NOT
1666	No , the staff ask me about filling / bread type etc so there is no room for error .	NOT
1667	No , they keep it pretty secret .	NOT
1668	I have the S2 as well , and as long as it's sunny outside the results are awesome . Macro works great too .	NOT
1669	Smallfats think they aint	IMP
1670	said the butthurt fat bitch/bear	EXP
1671	Bless you Hamphobia. NUMBER	IMP
1672	he graduated and became a mural.	IMP
1673	I have had elderly cashiers get the line going faster than young fat cashiers. This is including all the chit chat an elderly cashier wants to do, too.	IMP
1674	....Exist. Why do fat people exist...?	IMP
1675	just because he CAN finish a soda or a beer, doesn't mean he always does.  Everyone here is so paranoid.	EXP
1676	Calling fat shaming terrorism is like bringing someone to court because they said you'd look better with slightly taller socks.   It's ridiculous and they're probably right.	EXP
1677	Doesn't seem like a joke to me considering the original responses and the shit I am getting for even saying that original statement of mine.	EXP
1678	Holy crap! I have all of the exact same as you.	EXP
1679	WOw  so  many  fantastically  bullshit  headlines.....	EXP
1680	Prepare to be irl embarassed when you do!	IMP
1681	We haven't invited him over for some time now. It's just ridiculous.	EXP
1682	[I can only hope this women was enough to make up for it](URL	IMP
1683	This has been removed . Please use a reliable host as stated in the sidebar .	NOT
1684	"Yeah, the caption under the picture was like, ""Finally got to see fat bitch after NUMBER years, blah blah."""	EXP
1685	I enjoyed the Destiny series . It encompasses bits from ENT , TNG , DS9 , and Voy ( a bit ) . If you like the Borg , you will probably like this series .	NOT
1686	Red fat, standing by	IMP
1687	"Lol his bmi is through the roof at NUMBER"""	IMP
1688	I'm convinced that she's blackmailed him in some way.	IMP
1689	Wow that first pic is incredibly deceiving.....	EXP
1690	Its true . Paul is often the one dissenting vote just because he votes against everything . As president he'll likely be up against a veto-proof majority a lot of the time because of this . People who think RP can get in there and change how everything works don't seem to be aware that we have a system of checks and balances . The office of the president is , by design , one of constant compromise . If Ron Paul continues to be the same Ron Paul he will get absolutely nothing accomplished .	NOT
1691	That shit is scary	EXP
1692	I'm guessing the historical context would be helpful , yes ?	NOT
1693	I love how if you scroll down in the comments she's trying to argue with people in all caps.	IMP
1694	Or the patriarchy.	IMP
1695	That whale on the right might know a thing or two about the water that you don't though.	IMP
1696	I call them fat. I call my mom fat.	IMP
1697	Gengar, Gengar!	IMP
1698	I feel a little guilty for this, but she put it on the internet already. [Here you are](URL	IMP
1699	Man , I am interested in seeing ya at the end of Sixth Sense .	NOT
1700	Regardless of how misguided the effort may be , at least we are taking action . What matters now is action . , Action forces education . The only access to results is action . And by and large , we are decent people .	NOT
1701	I'd rather rip off my imaginary dick, cover it with lye powder and set it on fire than to have some fat bitch try to hit on me.	EXP
1702	Thank you for defending my precious cupcakes. They help keep me on the straight and narrow till cheat day because I know they are waiting there.	EXP
1703	Send that shit to David Attenborough.	EXP
1704	If your job is customer-facing, they should give you a raise because you're probably increasing business just by being attractive, unlike that deluded repugnant hambeast who drives away anyone she comes in contact with.	EXP
1705	Go somewhere else if you want to cheer on fatties for doing something they were suppose to do in the first place. Banned.	EXP
1706	Maybe I just don't have the heart to put folks down for being weird . If loving your fellow fans and tolerating the weird ones leads down a dark path , then let us post ponies in the shade .	NOT
1707	Your words are as sharp as your thighs are round. At least be entertaining with your comments.. You're boring :/ when's all that personality going to kick in?	EXP
1708	One non-ham is outnumbered by her ham mother, ham husband, and ham step-father.	EXP
1709	Bro , if I could smoke weed for you I would ... we needa chill again before school returns ! Hope your mom feels better .	NOT
1710	"Same with the ""tess doing X""  and it's a picture of a manatee, the joke is there, but stale."	IMP
1711	fat people are the only ones writing this shit	EXP
1712	Reading that exchange was so satisfying.	IMP
1713	If you were poor and had an extremely high marginal value for each extra dollar you had access to , I think your impulse control would be pretty low as well .	NOT
1714	Yup. It was ridiculous, there were so many fats this morning, just couldn't pick which one to take a picture of.	EXP
1715	The guy who does my tattoos, he has a photo of a woman's fat ass he had to tattoo once. He described it as tattooing sandwich bags full of gravy.	EXP
1716	Having legs and ass that look like two sacks of nickels in a pillowcase and posting pictures on the Internet will not lead to a wave of compliments. Better surround yourself with delusional like-weighted shebeasts.	EXP
1717	I honestly wouldn't even believe her then, it's too easy to mess with scales.	IMP
1718	Never trust somebody called Ragen.	IMP
1719	agreed. this guy looks like a corny douche, and he looks at least chubby to me.	IMP
1720	I'm getting ready to have kids and I already know I'm going to have headaches with this shit. I'm outspoken as fuck and very protective of the people I love so I'm sure I'm going to exchange words regularly with planets trying to feed my child bullshit.	EXP
1721	[ relevant ] ( URL	NOT
1722	Is this a joke ? Have it on the rocks , or in coffee with no sugar . Very delicious choice .	NOT
1723	So , how was it that your father was allowed to marry a non-Jew ? How would your mother feel about you marrying , say , a Catholic ? Or does she haven no say in the rule of rules ? Just curious .	NOT
1724	it made me laugh, good enough.	IMP
