	text	labels
3028	I can estimate how unhealthy a cart is by roughly how bright and colorful the items are lol. If it looks like a fucking neon rainbow, the cart pusher is most likely a ham!	EXP
3029	Even worse that he tried hitting me up on Scruff. I'm thankful for unlimited blocks.	IMP
3030	/r/ShitlordMeetups/	IMP
3031	"Basically I'm tired of people being unhealthy and taking ""Pin-Up Photos"" and making comments that back in the day men loved women with curves...and by today's model standards...yes women were larger back then...but they were healthy..."	EXP
3032	We could actually treat those who are mentally ill and homeless instead of letting these things leech off of taxpayers.	IMP
3033	_which the President adamantly opposes but was powerless to stop . _ No , he could've vetoed it , and refused to sign it until Congress removed those provisions .	NOT
3034	It's ...  sniff  ... beautiful . Thank you for your hard work and happy new year .	NOT
3035	Pandemic shitstorm-panic i NUMBER , NUMBER , NUMBER ...	NOT
3036	The guy hasn't had a jawline in so fucking long that he doesn't even know where it is supposed to be anymore. He installed it down where his adam's apple should be.	EXP
3037	This is gonna be one of my first posts in this sub. Fuck fatties, and most of all, fuck stupid fatties who think they know better than anyone else.	EXP
3038	It's also missing the pizzasisters4lyf hash tag.	IMP
3039	go for it . i got punched in the ribs and was floored last night	NOT
3040	Not really , I don't touch anything on the way back to my cube and I always wash so no shit on my keyboard . And even if I do get shit on my later A ) I don't obviously know about it like in the bathroom . B ) It has had time to sit there and evaporate / die	NOT
3041	Eh, it doesn't matter to them, as long as he's fucking ripped and six feet tall.	EXP
3042	cesspool of the internet not /b/	IMP
3043	This is why I hate Walmart.	IMP
3044	Good news: they won't live long either	IMP
3045	Percentage of main sub users that are fat or spineless : NUMBER% I remember playing with barbie and thinking she had thick thighs lol. Many of the other, generic dolls were thinner.	EXP
3046	Yes , I do all of those things and I regularly get blood tests done due to unrelated health issues . They've never found anything wrong that could have caused this , unfortunately . It would have made it so much easier if they did !	NOT
3047	Those stats are all from NUMBER-NUMBER.   I think we can do better than stats that are NUMBER-NUMBER years old.	IMP
3048	Physics and nature will prevent this from ever playing out.	IMP
3049	Could she not just... move the seat back?	IMP
3050	I hope you let them know they're not welcomed there, stupid fat cunts and their sense of entitlement knows no bounds.	EXP
3051	agreed . what for ?	NOT
3052	The obeasts really know how to ruin stuff. Tattoos, high waisted shorts, horn-rimmed glasses.... now Lolita dresses :(	IMP
3053	Just upgrade . I'm sure it's  possible  but if I remember correctly , quite hard and definitely way more hassle than it's worth and you're pretty liable to just break the thing .	NOT
3054	I take the red pill . I want to experience all of life . All of it is necessary , no matter what happens , everything you go through matters . Also can't I pick no pill ?	NOT
3055	Awimaway Awimaway Awimaway Awimaway from smashing another chair with me ol' thunder arse.	EXP
3056	They probably wanted to end that fattie's miserable life. And the world would praise the fat killer!	EXP
3057	Oh my god I fucking love your username. Literally lol'd.	EXP
3058	[ Brandon Roy retired early due to injury - in the beginning of his true prime ] ( URL	NOT
3059	Sorry to hear about your beard , but [ Male Group Therapy is this way ] ( URL No one here cares .	NOT
3060	 Noted for when I get a boyfriend .  Wearing a shirt this way would probably attract one . It would work on me anyways .	NOT
3061	Hams have no shame.	IMP
3062	NUMBER Coal for E . Y . E . ?	NOT
3063	Of course not; they are clinically lazy.   Looks good BTW!	EXP
3064	Keep trollin ' , trollin ' , trollin ' ...	NOT
3065	Omfg yes, fucking love gyros. Only in moderation though because they are basically just garlicky mounds of meat.	EXP
3066	Pisses me off that they aren't wearing shirts. Looks like they need bras to hold up their sagging bitch-tits too.	EXP
3067	You do know that is a bannable offense from all of reddit right?	IMP
3068	Mah hero.	IMP
3069	Haha I remember a post on here that was about a ham crying because snoop put a shitlord post on his Instagram.	EXP
3070	Holy fucking shit.	EXP
3071	I can only hope that ended in crushed metal, the stink of gasoline, and terrified agony for them as they expired in on the road....their huge panties filling with excrement and blood and their overused intestines smeared on the road behind them	EXP
3072	Possibly.	IMP
3073	Unfortunate: having or marked by bad fortune; unlucky   ...  I have to disagree, luck has nothing to do with that orbital body shape	IMP
3074	You can tell its old because Dale Jr . is near the front .	NOT
3075	better than blocking you up	IMP
3076	An open relationship is always an option : love him , marry him , and have lovers on the side . Don't worry too much about labels . What matters is being true to yourself .	NOT
3077	NO ONE WOULD CARE . THAT'S KIND OF THE POINT .	NOT
3078	lmao	IMP
3079	HAHAHAHAHAHHAHAH These are a bunch of fucking sourceless claims made by some butthurt anit-semite. I'm not even going to try to argue with you, all I'm saying is if you think a fucking picture with quotes that some basement dweller threw together proves anything or convinces anyone then I think you may need to reconsider.	EXP
3080	I don't think the first girl is fat but that is an awfully suspicious myspace angle style. Need more evidence for her.	IMP
3081	Ugh. There's an askmen thread going on now discussing this and it is brain searing in its stupidity.	EXP
3082	it basically means nothing is wrong with them except they are fucking lazy and stuff their face	EXP
3083	> I expect NDAA was put through to give them the power to round up dissidents , OWS and the like , and SOPA will be put through to allow them to quash internet sites that foment dissent . here we agree , i think all thats possible and it shouldnt be . the law shouldnt have passed . > Monarch , Oligarch , Plutarch . Whatever . my point is those are different things	NOT
3084	must find every episode	NOT
3085	No they can if you are cheating . Well could ... and steam does sometimes screw people but a lot less than EA .	NOT
3086	I think I am smart enough to draw such conclusions myself ... Egypt might like to keep people dumb and not think for themselves but I think I've outgrown that by now ..	NOT
3087	Granny panties. .. not hot.	IMP
3088	The way her legs pivot looks like an angry bull bracing itself to jump over the barrier, only if this ham did that she would find the gravitational pull on her planet is much stronger than earth	EXP
3089	Omg, if she gets signed on in Europe, I'm freaking done.	IMP
3090	It should be banned, fat bellydancers are everywhere and its revolting.	EXP
3091	She was probably looking depressed because she has to deal with stinking fat lard buckets all day who find their blubber and shit health amusing.	EXP
3092	Man I feel bad for ya , I'm sitting her blazed with my parents watching Beavis and Butthead waiting for the New Years show . True story	NOT
3093	Jesus fucking christ, the entire film crew from LOTR must be watching her then!	EXP
3094	  SWEET BERRY WINE !  	NOT
3095	Well , always glad to have an admirer !	NOT
3096	I love seeing a spider suplex ...	NOT
3097	"Created by a shitlord from FPH, I present to you: r/paintedsausages You should send it there, they'll ""love"" it!"	IMP
3098	I'm NUMBER . We can be socially awkward together . :)	NOT
3099	I would love this!  I don't even mind stumbling for a few miles when piss drunk.	EXP
3100	Let the wins speak for themselves . I personally try not to make any judgements about my opponent and let that person's skill at the game do the talking . You will also find that terrible players complain in same fashion you spoke of , regardless of who they are playing against .	NOT
3101	I'm fine with letting children choose to leave . Even if it is just because they aren't allowed chocolate and ice cream for dinner , they would likely come back in a few days . My only point is that most children would accept their slavery ( as long as more polite terms are used ) and so should be bound by any social rules voted on by previous generations . The right to leave , disband or revoke rules of a society should exist , because the right to make rules by majority should exist . Its only if you argue that the only legitimate rules are those unanimously agreed ( likely zero rules ) that children should not be bound by them upon reaching the age of emancipation . But there are zero rules anyway , so it doesn't matter .	NOT
3102	I'll give NUMBER coals ! URL	NOT
3103	Sweater looks like it's about to pop with all the shit inside of it	EXP
3104	Mein NUMBER lb kampf	IMP
3105	Holy shit, long time no see!	EXP
3106	Not having the balls to veto the bill and call out the perps does not let him off the hook . Balls Obama needs to grow some .	NOT
3107	She had to get dinner on the table, or dinner would be her babies.	IMP
3108	These are my husband's food groups , sweet and salty . His cholesterol is bad , but not the way you'd think . Because he's got Crohn's Disease and is missing half his large and a third of his small intestine food goes through him like shit through a goose , so to speak . He takes handfuls of Colestid pills to slow down his gut . This further reduces his cholesterol . Last time he had it checked his total cholesterol was NUMBER . If I ate his diet , I'd be dead in a year .	NOT
3109	I bet she ate the tube of lipstick shes wearing.	IMP
3110	No , it's fact . :D	NOT
3111	NUMBER an hour canadian	NOT
3112	Maybe you should strive to be neither, they are both drains on society.	IMP
3113	Mayo, though, seriously what the fuck?	EXP
3114	Stop fucking fatties and wash that grease off your dick before you come for girls like me.	EXP
3115	That bitch hasn't felt hunger once in her life.	EXP
3116	That happened to my boyfriend today when we were out shopping. He usually wears a NUMBER or NUMBER in jeans, had to buy a NUMBER.	EXP
3117	She is checking out from the world, but primarily from you. Cut the bitch loose if she doesn't respect ur wishes.	EXP
3118	Dressing up as different people is fun. I can see why people would think it's weird though.	EXP
3119	It comes with a side of diet coke and a suicide note	IMP
3120	I believe its a female, but don't take my word for that. All I know is that it has no jawline, and a very punchable face.	IMP
3121	da fuck	EXP
3122	[ relevant ] ( URL	NOT
3123	Neither am I . I'd stuff her stocking	NOT
3124	It's possible someone has posted this convo before, but I did put this image together.	IMP
3125	Wait wait . Harry Potter was crap ?	NOT
3126	Lmao that's just sad. Are we sure this idiot isn't trying to be funny?	EXP
3127	It was not a fetus , it had been delivered and lived two hours .	NOT
3128	Since you're Jewish , OH , G-D WHY .	NOT
3129	disappointed	IMP
3130	For every NUMBER you see, she discarded NUMBER.	IMP
3131	God I fucking hate that smug POS.	EXP
3132	Wrong, that would imply that these people were bright.	EXP
3133	I crafted NUMBER valve coupons in a row . I'm not crafting anymore .	NOT
3134	I thought that's why all the coats at Walmart were cheap. They don't have to be warm because fat people don't get that cold.	EXP
3135	nice!	IMP
3136	Don't forget airbrushing the mass cellulite off her limbs off to make her seem less repulsive.	EXP
3137	No you're not stupid , don't change it . Coin flips are not the most accurate randomizations of a NUMBER % chance . There has been a lot of research done that most coin flips do not rotate enough to be randomized enough . Just google it . NUMBER sided dice , given enough tosses in the hand , are a much better way of generating a random NUMBER / NUMBER chance . Oh I like your cards btw .	NOT
3138	OR CHOOSE YOUR FOOD AND DIE!	IMP
3139	Whoops, looks like I'm the idiot this time!  That makes way more sense.	EXP
3140	And if we had Bynum in for either of those games , Odom would have been a nonfactor . Doesn't matter though , because Bynum came back now and Odom ain't never .	NOT
3141	Who would fuck that guy to get him pregnant?	EXP
3142	What a narcissistic fat fuck.  Everything she said seemed spoon fed from another fat fuck feminist PR candidate.	EXP
3143	It's weird cause your family can choose you. I feel like a Pokemon now.	EXP
3144	URL Yea, here's a link.	IMP
3145	NUMBER coals and deal	NOT
3146	Can you elaborate on why you think this ?	NOT
3147	The excuse that eating healthy is expensive makes me die a little on the inside every effing time that I hear it.	IMP
3148	I guess you could say that, yeah. It's a very large city, but not necessarily one where you can walk everywhere.	IMP
3149	URL	NOT
3150	true.. but my accounts lead to someone. the satisfaction i get when i get a message from some fat fuck telling me they know who i am is too good for me to ignore.	EXP
3151	I have a smartphone , but I don't have any data plan .. I'm too poor . And when I have wifi , all I visit is facebook or sports website .	NOT
3152	I'm sure there are plenty of people that could and want to help you with that, myself included	IMP
3153	I hate this more than anything. They love their double standards.	IMP
3154	As a fat person Gross, nobody cares.	IMP
3155	Wow thanks for linking that. Gonna use that in future fatty battles.	IMP
3156	Stage curtain, obviously. You can tell by the grotesque above it.	EXP
3157	The comments under each picture are revolting! I really didn't think there would be that many people admiring and praising these disgusting depictions of obesity.	EXP
3158	You sure they are fat?  I mean, their arms are not fat, they are getting salad, etc...	IMP
3159	gg to you too ;)	NOT
3160	I fucking love junk food but I don't eat  it everyday.	EXP
3161	Why do they always expect people to throw them a parade because they've stopped being a disgusting gluttonous fuck and decided to behave like a human?	EXP
3162	nj ?	NOT
3163	Throw him down the middle shaft and use his ham body as a cushion for people fall on to safely? Might hurt your back lifting the guy, but a big fat cushion could save your life!	EXP
3164	That's slower than my friend's Chihuahua walks.	IMP
3165	"It's not even a ""some people will find it too this or that."" The creator of OKC puts out blogs every once in a while with tons of statistics and the subreddit, compiled it into a really nifty guide to making a statistically better profile without resorting to catfishing like the person OPs post."	IMP
3166	I love A1 on burgers and other things, but never steaks	IMP
3167	That pathetic fat shit can't even stand still.	EXP
3168	By that logic, you have to fire old people, and most women. A fucking trolley is not worth chasing someone down.	EXP
3169	If she were actually capable of skipping, the tectonic shift in plates would make Lex Luthor from the first Superman film quite jealous.	EXP
3170	Mine was rather similar to yours . A very small sudden injury to my thumb . Tore a small piece out of the middle of the thumb nail , leaving jagged shards of nail in the wound . Extremely painful , but so small I thought I could just shrug it off . I tried shaking my hand - big mistake . Then I tried running cold water over it - another mistake . Then I tried ignoring it . Next thing I knew I was on the floor and my friends were picking me up . I had gone completely unconscious , face first , down to the cement floor , but fortunately my face was saved because I was close enough to the wall to hit my forehead into that first . Left a good sized hole in the drywall , and cut my forehead a bit , but that was really nothing , compared to the pain in my thumb . I had always heard about how bamboo under the fingernails was a terrible torture , now I think I know what it feels like . Only thing I wonder now , is how they keep the victim awake long enough to question them .	NOT
3171	"I maybe a fat kid at heart, but I'd say my primary motivation for running NUMBER miles rather than NUMBER is because I like beer and wings So to balance it out I workout more to allow myself the indulgences But I think a key difference is that for me, the joy in these ""fatboy foods"" is that it is so limited, and I have to work so hard to enjoy them.  And that makes it that much more special to enjoy a stout when I only have one once a week rather than every day with every meal"	IMP
3172	And he said we shitlords are the disgusting ones, hahaha.	EXP
3173	maybe there's truth to that but you don't have to be condescending	IMP
3174	Simplest answer is get boots fast .	NOT
3175	Just grab a hold of them!	IMP
3176	Thanks I bet she ate all of those genetics at once...	IMP
3177	Of course . And their coming to get your guns and put you in the FEMA camps for your gay indoctrination . Just stay home and wait for the van .	NOT
3178	When I was in Oregon , my friend ordered a salmon and pineapple pizza . I choked down a slice as not to be rude . An hour later , I burped and then puked a few moments later .	NOT
3179	SWAG Smelly, Weighty and Grotesque.	IMP
3180	"You'd be surprised . We have grocery outlets here , I don't think they're usually expired but a lot of the expiry dates on "" non-perishables "" ( canned goods , etc . ) are way earlier than when the food actually goes bad . There's a lot of good stuff there that's perfectly fine , I've never bought anything that was ' bad ' . But then , I don't buy there exclusively either because in some cases it's more expensive than going to our local grocery store because you can't really get what you need , just a bunch of wildcard items . It's great for personal care products , too . I go there on a whim sometimes . :D"	NOT
3181	Start by running away from that monster.	EXP
3182	He's got a derpy eye	IMP
3183	Both of the random tag matches he's been in have been fucking great . Last one was just poetry in motion , and this one was hilarious . this being TNA , however , I'm sure my joy is fleeting .	NOT
3184	I should have mentioned , it was limited to NUMBER words or less , so that's why she decided to write it more as a character portrait or vignette . I don't know the terminology , so that's my fault for calling it a story I guess . Thanks for the feedback though !	NOT
3185	Look at fucking Hamzee's room It's a bloody mess.  Hopefully someone got the name-pun-joke	EXP
3186	""" housekeeping """	NOT
3187	Democrats : - yes to foreign wars - yes to drug war Republicans : - no to bringing troops home - no to getting rid of drug laws	NOT
3188	because validating their sex appeal means they are attractive.	IMP
3189	"Obama has the  power  to do that . Just like any other president who is elected in the future ( now that the bill has been signed ) . I don't think his reassurances will stand up to scrutiny when he establishes martial law . > "" jk guys ! I really just wanted a police force . """	NOT
3190	Yeah, you obviously maintain the same weight if you just keep count of your calories, the real problem is eating unhealthy food every day, as seen in Super Size Me documentary URL	IMP
3191	Thank you for ruining flapjacks.	IMP
3192	I'd stick your dick in it for money and fame... Sorry.	IMP
3193	"""Sorry, the only thing fat about me is DIS DICKKK."""	IMP
3194	"fatpeoplestories is just as bad. ""Be me 800lb hammy who had a salad last week, don't be Lardass who only eats cheese."""	EXP
3195	Beautiful.	IMP
3196	Barber: whatchu thinkin?   Ham: just fuck my life up   Barber: I gotchu fam	EXP
3197	I consider Halo : Reach to be one big plot hole . It would be easier to list the things they didn't mess up than the things they did .	NOT
3198	1920x1080	NOT
3199	twas NUMBER yrz ago this day .	NOT
3200	Oh I will don't worry . Might not be for awhile , but I won't enter any giveaways until I do .	NOT
3201	What's with the hashtag EdRecovery? I hate when fat bitches try to convince people that they are anorexic	EXP
3202	Yeah it's turning into a never ending circle jerk of misinformation and bullshit with these hams.  It won't be long before it becomes actual recommended reading material for Fat Studies or other retarded, academically pointless college courses.	EXP
3203	We sentence them to a diet for the rest of their lives with no possibility of cheat days.	EXP
3204	What a clueless moron you would have to become If a connection with health and weight, you find none There are multiple relations with health being affected by weight So just get the fuck out youre banned, and no time to debate Frankly it would do nothing, for I doubt in reason you listen You must either be fat, or with one whose ass you are kissin So leave this great sub, and try not to be spiteful But frankly that would entail a ham whose insightful And if that was true than I must ask you a question Why stay fat, perhaps I may give a suggestion To seek out a gym or at least regulate your consumption For obesity is bad for health it is not just assumption It is backed by something we call medical science Not tumblr post lies and not fatty compliance	EXP
3205	Toonami . Enough said .	NOT
3206	"Silly ""projecting"" hamplanets. Keep in mind, what THEY call bullying and hate and what not, is just....DISAGREEING...with...them."	EXP
3207	I'd say a more apt comparison is addiction -- which is what it is, an addiction to food/sugar and the rush of endorphins it gives. It's not as hard an addiction to give up as alcoholism or heroin, but it's not necessarily easy.	IMP
3208	"""We've got a real Maria over here... Yeah, like a mega Maria."""	IMP
3209	Got Defence Grid yesterday . Hard Reset a few days ago .	NOT
3210	"He does identify with him, can't find the link now but he also mentions not getting why women prefer the hound to this ham, because he's basically a""nice guy """	EXP
3211	feet, in circumference.	IMP
3212	Yet you see people missing entire limbs out running or staying in shape	IMP
3213	PS : I realize OP is from a different movie . Must be Casino , right ?	NOT
3214	I may not be a hambeat, but at least I'm not an illiterate dipshit. lol	EXP
3215	because I am going to make it a positive interview	NOT
3216	If you get fired for wearing a blue shirt, don't wear a blue shirt to your next job.  Is that so hard to figure out?	IMP
3217	"I'm not sure about the medical term but in tumblr speak they call it ""look at me I'm a special snowflake who has to resort to other means to get attention to distract you from my fatness"""	IMP
3218	Its so nice to be around ladies who know the struggle. fuck fatties.	EXP
3219	Give MG a break! It's hard to read with her fat forehead pushing down on her eyes all the time.	IMP
3220	HAES success story im guessing	IMP
3221	They are officially licensed games . They just weren't  developed  by Nintendo .	NOT
3222	If you only saw her face you would never think she looked like that from the neck down	IMP
3223	That's powerade, athletes drink it so it must be good!	IMP
3224	Jesus Christ, what a fucking loser.  At least that pic with the obese Playboy bunnies reminded me of the Ludacris song [Fat Rabbit](URL	EXP
3225	Definitely the second theory.	IMP
3226	"Shit, her first words were probably ""big mac"""	EXP
3227	"I hate how good the mods are surely this post would get some fatty hate! But no it's a fucking ghost town of positive comments -.-"""	EXP
3228	"Happy new year from "" Dark Side Of The Moon "" - man !"	NOT
3229	The second to last picture looks like hank hill's ass.	EXP
3230	Starshitlord, right there.	IMP
3231	Omg gilded	IMP
3232	I like running really hungover just to puke. I think it goes back to my hockey days when my coach would bag skate us until we were dry heaving over the boards	EXP
3233	Yeah I've been doing since since Jan.  Just make sure you work on good form when you start with the lower weight before you get into the heavier ones. My lower back would hurt and my legs didn't feel right about a month into the program, but I double checked my form for squats and overhead press (and took NUMBER days off) and I've been fine since.	IMP
3234	"Glad to hear it  Spread the word  [ ] ( / b10 "" And the love ! "" ) [ ] ( / b35 "" Why can't I hold all this adorableness ? "" )"	NOT
3235	"Maybe that was the biggest they offered, or maybe those items were supposed to be ""one size fits a range of fatties."""	EXP
3236	I think your violin might be better than mine . / jealous Good work , though it's not good for you or your posture to stand with your knees locked like that . That might have a lot to do with being slumped . Also , the interest in the piece will double automatically for your audience if you showed you were excited about it . I'm sure you are , but as it is we can't tell .	NOT
3237	Can someone ban this disgusting lard bucket.    Edit: I have messaged mods.	EXP
3238	franzia , the big box .	NOT
3239	Strange how much of a dick a forge looks like at this angle .	NOT
3240	You probably don't need the SSD . They're nice but not essential to a gaming rig . I would also go for a bigger PSU . 600W should be okay but it's always better to have a little more . I think the GTX NUMBER requires 550W so go grab the Corsair 750W modular PSU .	NOT
3241	I was mentally preparing my self to see what was going to be dead , NOPE ! dog in sand	NOT
3242	4chan / somethingawful	NOT
3243	Where else?;-)	IMP
3244	You stopped ?	NOT
3245	I think this is from some event a major convenience store did where you can bring anything you want and fill it with slushy. Theres a newer post that has an album of it.	IMP
3246	I couldn't compare a rabbit, even a pudgy one, to Mess Chubster. Bunnies are adorable - that thing is just a mountain of snot, lard and vanity painted with makeup.	EXP
