	text	labels
0	I kinda wish he hasn't said hammy. Then the punchline would have been so much better.	EXP
1	I am more shocked at the growing obesity problem. If fat fucks are too stupid to have the discipline to control their food intake ...or they just don't care why would they care about anything else .	EXP
2	Button-up shirts with the sleeves rolled up to the elbow . Mmmm .	NOT
3	No, I was referring to Florida, sorry should have been more specific. Come to think of it , might have been because it was off peak.	IMP
4	... Kill it with fire?	IMP
5	She gambles in so much ways Alcohol will make her hypoglycemic (in addition to her inebriation and pre-existing stupidity)	EXP
6	REALLY?? That's refreshing to hear.	IMP
7	How do they considered letting themselves eat a ton on Easter any different than any other day for them. They eat like cows everyday shouldn't be anything new for them.	IMP
8	[ r / HomestarRunner ] ( URL	NOT
9	I can't express how much I hate fat people feet.	IMP
10	Quit acting appalled at the fact this women has flies swarming around her ass crack?	EXP
11	Seconded on the thank you	IMP
12	Don't forget the shawarma .	NOT
13	Until you realize you need motion plus to play it	NOT
14	I'm a tarp. You've triggered me!	IMP
15	Stop swoleshaming.	IMP
16	Hiding her fat stomach in another room while she takes a selfie, classic	IMP
17	I honestly cannot tell which one is pre wrap and which one is post wrap.	IMP
18	"I've noticed that self-described ""chocoholics"" don't appreciate dark chocolate at all. I love dark chocolate, I can't stand that fake Hershey shit or most other milk chocolates."	EXP
19	...except not all bodies are beautiful. Fat is ducking disgusting.	EXP
20	He begged to be in that movie and only made $60k from it.	IMP
21	Yeah, its on the right, under Related Subreddits. Verified shitlords can ask mods for access since its private now.	IMP
22	What ? No .	NOT
23	Provide citation from that signed bill that proves American citizens can be indefinitely detained or terror suspects no longer have access to civilian trials . After all , the  burden of proof  for your claims is your responsibility in political , academic , or any other kind of debate . Until , you provide citation that supports those claims about NDAA , you are just another unfortunate person regurgitating unsupported talking points . ( Hint : Lots of us have already read President Obama's signing statement regarding NDAA and know it clearly states the indefinite detention of American citizens is not allowed ) .	NOT
24	Damn, those are students?  I thought they were middle-aged men.	EXP
25	On Halo , those fucking bastards .	NOT
26	Real question, isn't it extremely hard to do ballet unless you're a stick? I'm not saying this woman is healthy or doing ballet correct, but I just always associated ballet with thinness.	IMP
27	kickme444 confirm'd fat fuck	EXP
28	Is ANY thing actually supposed to be fat?	IMP
29	Do they think that it's related to the fracking ?	NOT
30	Do you think the republicans would have not funded defense if Obama refused to sign the bill with these crap provisions ? He could have easily gotten around this and the fact that he didn't even try is disgusting and pathetic that he tries to blame others when he does sign it . Hope and change ? Or more of the same ?	NOT
31	Your submission was removed for the following reason(s): - It is a recent or common repost.  If you feel this removal was in error, please [message the moderators](URL	IMP
32	IT was a wall of text that started off with a fallacy . You're a disingenuous jackass who follows me around . I'm not going to waste my time with your nonsense !	NOT
33	Vicar of Dibley would have been so much funnier if it wasn't based on her being a fat ass.	EXP
34	"""I was born with heart disease."" I can hear the hohos giggling in her esophagus."	IMP
35	Can we just agree that the opinions of fat chicks on what straight men find attractive and on what they personally find attractive are irrelevant?   Who cares what these losers and rejects of the sexual market think?	IMP
36	yeah but don't you know this ham is actually healthier than her, the sister is actually skinnyfat, while hamblrina is amazingly fit /s	EXP
37	In fairness , you'll have a pretty hard time hacking my PowerBook 145B that I only use as a portable serial terminal .	NOT
38	Hey lard fuck: I need a mate that can ride me without crushing my inner organs. So literally anyone that isn't a god damned food monster already fucks better than you.	EXP
39	"oh my god... the comment ""Don't listen to these assholes. You just keep at it and make them cry wishing they had dat ass"" crying a fucking monsoon of cringe"	EXP
40	I bet not even the feminist dumbfucks thinks precious looks good.	IMP
41	It's like there's no need for pants anymore. sheez	IMP
42	Even as a child, I hated Mountain Dew. I'll stick to ginger ale and water, thank you very much.	EXP
43	Most of them were. There were a few normals in there, but mostly fatties.	EXP
44	That means she eats bullfrogs.	IMP
45	This was awesome!	IMP
46	"I live in the city , so I have a lot of them . One day I was walking down the street and this homeless guy , instead of asking for change , just goes "" Ah , you're wearin ' beach colors  "" The best times were with my boyfriend , though . The first time he came to the city we were walking and a homeless guy said to my boyfriend , "" You guys are a great couple  If you wrote a book , I would buy it . "" Another time , a homeless guy who was peeing in an alley said "" Y'all still looking great together ! "" and then later tried to pass us saying , "" Man , you in my way , but you got a fine girl . "" ETA : One time this older non-threatening seeming woman came up to me , looked me straight in the eye , and goes "" Are you fucking with me ? """	NOT
47	Senior in college, studying writing, and she can't even be arsed to throw a fucking comma in there someplace?! Lazy shit doesn't even care about English, it's all about her creativity.	EXP
48	This woman is slowly overtaking ArteToLife and Ragen Chastain as the most insane fat person in the world.  She can spend all this time, effort and money trying to convince other people, but at the end of the day who is she REALLY trying to convince?	EXP
49	Wasn't ready for glitter udders	IMP
50	It must stink really bad in its room.	EXP
51	varg_18@hotmail.com	NOT
52	"I'm not, either, but not going to antagonize or troll them.  Let them have their ""safe"" space free of reality and criticism."	EXP
53	Her ass looks like it's eating her britches	EXP
54	"The tattoos on the forearms don't correspond in some of the pics... And once again we see the hammy's predeliction for hair colour ""I'm just so craaaaazy"""	EXP
55	fucking loved the old fit people at the end. great album	EXP
56	curtsey	IMP
57	god damn count me in . The first time i did it , i went for say NUMBER days or so idk , but everything in my life improved . right now im at the lowest of the low ... life sucks right now . Im hoping this will bring me out of the hole im in .	NOT
58	revolting.	EXP
59	That assumes our government is charging more for the arms than they paid - not necessarily so .	NOT
60	Really though, bacon and nutella sounds disgusting.	EXP
61	The reason I say this is because the hardware survey apparently analyzes the computer that is to be used so if I do the survey it might not let your friend use it .	NOT
62	Phew, my condolences. You were set up with that rare breed known as a Cutter Ham.	EXP
63	I missed the story behind it - can you link me?	IMP
64	His face needs to be on /r/punchablefaces	IMP
65	Lose some weight and a lot of things won't be exhausting.	IMP
66	If I actually knew you, I'd invite you to join!  You know what they say, sharing is caring NUMBER	IMP
67	Amen . Good to remember this in very good times as well as very bad ones .	NOT
68	Source: URL	IMP
69	At the hospital, of course. HAES.	IMP
70	NUMBER Protegé NUMBER-speed ( basically the model year before your car , bro ) I bought for 5k with 48k miles on it . Best deal of my life . First stick of my life . Top reason I'm sad the world's running out of oil ( I doubt we'll have stick electrics ) .	NOT
71	Sorry, but what is it mean to be 'verified?' I've heard the term thrown around a bit but i still know not what it means.	IMP
72	She looks sooooooo saaaaad.  It's hilarious.	IMP
73	And someone reported this for 'nigger'. No, srsly.	EXP
74	At least	IMP
75	Did the assailant fuck her before or after?	EXP
76	"They keep using that word ""curvy."" I do not think it means what they think it means"	IMP
77	She only has one leg?	IMP
78	 but I cannot compete with wealthy people Which is why sometimes the Hams of Old still get the young, fit ones.	IMP
79	I did read something similar with a tube sock ( which I don't own ) , I'll have to try it .	NOT
80	Those countries you mentioned propped up a government that starved its people and squandered their nation's wealth on their personal lives . Say what you will about how they've spent their money since , but at least their leaders don't live in a lap of luxury while their people die .	NOT
81	It's like a fat obese food predator.	IMP
82	> In that case , you'd probably feel right at home Poland isn't empty / agricultural if that's what you meant . That's why the land is kind of expensive .	NOT
83	Yeah... he ain't gaining nothing from this my ass.	EXP
84	bruh	IMP
85	[ excuses .. ] ( URL	NOT
86	How often does it really stay off though? It seems mostly they lose some weight, keep eating shitty and gain it back.	EXP
87	well ... if everyone in the United States took their money out of the bank .. we'd find that we couldn't take all our money out . thus some of our money is intangible too .	NOT
88	Yeah I don't see how the meal wasn't comped for him.	IMP
89	Found the... White trash feminist fatty? What the fuck haha	EXP
90	I think its a bunch of bogus.	EXP
91	/u/unicornpotpie I'm truly sorry for your loss. I hope you find support here online x	IMP
92	"""smallisalsoprettyrad"" lol... like she's trying to make herself look like she gives a shit about thin people"	EXP
93	And to add insult to injury, she was too fat to ride the horse!	IMP
94	"Not an American? ""Tee hee"" is an 'innocent'  feminine laugh."	IMP
95	"It's okay friend . Yahoo mail's UI is vastly superior to Gmail atm . Christ I was saying this to someone and he was like "" oh did you try out the new gmail yet "" and I thought maybe google improved it somehow yet when I chose to use the newer version , they managed to make it look even worse ."	NOT
96	She lost her fucks when she decided not to care about herself and be obese as fuck.	EXP
97	Thankyou ! :D	NOT
98	Holy shit. It's Chicken Little's sister, Chicken Big Bitch.	EXP
99	Oops, I do. I'm in Australia, so,strikes I forget things aren't upside down stateside.	IMP
100	The fat logic in the comments is so thick I can barely muddle through it. URL	IMP
101	[ Step NUMBER . ] ( URL	NOT
102	Part of me is simply aghast at the degree of carelessness exhibited in  the edition-selection process... The other part derives too much amusement from the final product to really care all that much.	IMP
103	She got offended because she knows she's fat and ugly.  If someone called me black I wouldn't get upset because I am black.	IMP
104	The article said nothing about it being healthy.	IMP
105	"I look at these pictures, thinking ""when did Tumblr become a place for NUMBER-NUMBER year olds?"" before remembering no, they're probably NUMBER-NUMBER but in ham years."	EXP
106	The folks over at /r/trashy would love this shit - you should post this there too!	EXP
107	Cat's don't need to be walked, but what are the odds that these people could feed one the correct amount of food, play with one, or even let it outside?	IMP
108	I had no problem with dating a mom , but the fact that her kid was awake in a room less than NUMBER feet away is kinda tough .	NOT
109	Pretty common if they're comfortable with their own sexuality . For me though , I can't stand it . It just makes me feel like I have to go to the bathroom .	NOT
110	Murica, bitch! Naw, I just value real shitlording over fake stuff.	EXP
111	Shhh ! ;)	NOT
112	Jesus, that's even worse. And fuck right off with your math privilege!	EXP
113	I'd call them worse.  They are criminals.	IMP
114	On a positive note, they can just hire a butcher for the meathook-part. No way anyone can do more damage to the skin than the ham already did.	EXP
115	They could save a lot of energy and just stand on them.	IMP
116	Unless youre buying reaaaallly shitty food, Vegetables ARE cheaper than cheeseburgers.	EXP
117	How did the Chuckie Finster looking dickhead die but the fat-as-fuck dog is still alive?	EXP
118	What in the hell is it??	IMP
119	To be fair, if you're going to a shop NUMBER - NUMBER times a day to buy a mountain of junk food, I'd put good money on you being bulimic or a compulsive over eater. Both of which are vicious mental disorders.	EXP
120	sweet fuck .	NOT
121	Ugh, if you're willing to have sex with that thing and catch saomething nasty as a result, you deserve it, no sympathy from me!	IMP
122	"And your fiction about the Muslim cult just make you think it's about "" dem terrorists ! "" , but you don't seem to get that cults don't equal terrorists . Islam is just a cult created by a loon with a thing for porking little children ."	NOT
123	hes good , and i dont really like banksy , but those are only NUMBER pictures ... and banksy used his enviromeny more creatively , did sculptures , and sent important messages . i believe your brother needs more credit but i still think banksy is better	NOT
124	Prolly shoulda enhanced those CSI screenshots a bit .	NOT
125	Love it! It's about time they were called out on rather than letting them turn into NUMBER lbs eighteen year olds.	EXP
126	OP if you are reading this you are doing it all wrong   Take all that fat rage you used to type this long note (while sitting on your ass, no doubt) and turn it into positive energy on a treadmill or something!	EXP
127	But they entirely miss the sim target . Always have . Plus they're notorious for not fixing bugs in their games . Just look at the F1 series .	NOT
128	YOU DID IT !	NOT
129	"Yeah , but , i mean ... I thought the point of secret santa was a gift exchange between redditors , not a "" sign up for reddit to participate "" thing ."	NOT
130	that's fucking awesome- you can also use the cheap shitty ingredients on the hams too- save the organic stuff for the fit colleagues ;) I used to do a similar thing to my fat, nasty ex- i'd make him mashed potatoes loaded to the max with butter, cream and cheese... morbid curiosity about his limits. He didn't seem to have any :l	EXP
131	Will she be really cold in the winter? Yes, but she's not starving.	IMP
132	"I wonder how many Philistine farmers were just minding their fields , when they suddenly got ganked ? RPG , OT Style . Saul has given you a quest : Quest : Collect NUMBER Philistine Foreskins . Reward : Son-In-Law , his daughter Michal in Marriage Reviews : "" NUMBER Stars . Killing soldiers with the jaw of an ass is a lot of fun when you play the Samson level . But the grinding can be brutal at time . Killing NUMBER philistines , and removing their foreskins ? I could have done without the harvesting animations . The gamedevs must have one sick sense of humor . Also , with the Red Cross now saying military FPS games should seek to minimize civilian casualties , or at least discuss the issue of warcrimes , they will have a field day with this game . The Amelkhite campaign is especially nasty . Upset you can't kill kids in Skyrim or Fallout NUMBER ? Well , no problem here . The only ones you can't kill are the female virgins . I know this game is based on a famous book , but wow , just wow . And they have the gall to complain about "" Postal NUMBER "" or "" Skyrim "" """	NOT
133	Maybe they tie sex toys to one of those washing sticks and just poke at each other.	IMP
134	No, thats not the case. Sorry I should have clarified that those were just the words I used to describe my former self.	EXP
135	Wheymen!	IMP
136	that's insane, I'm pretty sure I could survive an entire week with $NUMBER as opposed to one single meal	EXP
137	Saddens me too. Benned.	IMP
138	Collinsworrth , Merrill Hodge and John Gruden make me vomit blood .	NOT
139	No thanks .	NOT
140	Herpes Baconita.	IMP
141	Are you an idiot or just didn't read the title of the subreddit?	EXP
142	Wouldn't you rather have 50lb of skin over 200lb of fat anyway? They both look pretty shitty but at least skin won't kill you.	EXP
143	That is not an inverted triangle. That's an ice cream cone.	IMP
144	Ted Bundy : Rape, Necrophilia, NUMBER+ counts of murder Jesus christ.	IMP
145	I haven't used one yet, but judging from before and after results, they really do work to make your waist smaller.	IMP
146	"i don't know if it's etiquette to reply right away , so i'll leave this as the last . also , upvote for use of the word "" balderdash . "" in God's eyes , one sin makes you imperfect and therefore unworthy of going to heaven . "" all have sinned and fall short of the glory of God . "" so without Forgiveness , we're basically all assholes . any degree of good or bad is entirely manmade . and so who gets to decide on the definition , then , if not God ? i contend that if Hitler actually did repent before death ( and actually mean it and not just say it ) , then he would indeed be in heaven . what about one of the two guys who were crucified with Jesus ? he got to go to heaven , yet you can presume he was probably a really shitty individual for getting crucified and all . i find it very comforting to know that if i do something bad that i'm not condemned for it ."	NOT
147	Fatsion is apparently colorful trash bags and ankle straps. Nothing good can come from either.	IMP
148	"""Can't believe they don't understand this shit"" They certainly understand it. They are just in denial like most fat people are."	EXP
149	WHEN YOU PRY HER FROM MY COLD DEAD FAT HANDS So pretty soon?	IMP
150	I hope it's just fats exchanging money.  It's still infuriating because  the money is no doubt government funded assistance for these wastes of space.	EXP
151	That's okay, I got enough advice to be satisfied. sorry!	IMP
152	I don't think there is a size big enough.	IMP
153	"""Oh hey, I'm not trying to troll or anything.."" comment in SRS is on front page of userpage."	EXP
154	Fucking liberals ruin everything .	NOT
155	"""/u/wondergirly, why is your ass so fat???"" ""I stubbed my toe."""	EXP
156	"Um , I think you mean "" mind = blown . "" Come on man . Get with it ."	NOT
157	look up day game. good pick up artists have mastered the cold approach during the day and can easily get girls' numbers.	IMP
158	Actually I'm on a laptop now and I still don't see them...	IMP
159	"Haha, to be fair she was impregnated by an alien and that's why she was so hungry, when she explodes a bunch of alien slugs are released. It's the perfect movie to watch with a fattie an be like: ""eww, can you imagine being that big?, is disgusting, and how she eats aghh.."""	EXP
160	When you're so fat that we can't actually tell if this is NSFW, that should maybe be a wake up call to stop eating.	IMP
161	So fucking fat it's hair follicles are stretched. Now that's what I call an OBEAST!	EXP
162	What is it with these manatee brides and their skintight dresses? What's wrong with a nice Pride and Prejudice-era A-line frock that hangs over gunt and arse?	EXP
163	She's NUMBER if I recall correctly.	IMP
164	Look at the strain on its fucking pants-seams. If those pants let loose, it's a butter flood in the train station.	EXP
165	Is that an OTF ?	NOT
166	Did their knees buckle under all that weight?	IMP
167	We are assholes. Still, it is much better to be an asshole than a fat fucking pig.	EXP
168	Hey typing that out burned like .NUMBER calories. Gotta refuel then get right back to it.	IMP
169	More like SHAMEchat.	IMP
170	A lot of guys probably learned they were bisexual after encountering real-life tumblrhams.	EXP
171	Stuffs bowel obstructing levels of cheese covered potatoes into their slithering, gaping maw	IMP
172	To freak out at the end and jump out onto your face ?	NOT
173	Can I ask you what program you use to stream ? and if you do anything extra to make BF3 stream ? I can't seem to get it to work , the streaming works fine , but when i go to BF3 , all you can see on the stream is black .	NOT
174	What a fat cunt.	EXP
175	"thanks for posting your shitty fan "" art """	NOT
176	Quality over quantity. At the end, the ones who are loyal are the most valuable, the rest are just detail	IMP
177	Yup.  She picked up her own freshman fifteen, then helped out a couple of her friends by picking up theirs, too.	IMP
178	Welcome back to humanity!	IMP
179	The fuck is the point of her going to school, as if shes going to live long enough to benefit from an education.	EXP
180	Im sure the corset is there to accentuate her hourglass figure.	IMP
181	I think that even Cap would get exhausted carrying her ass around.	EXP
182	What the fuck do they put in those tortillas.	EXP
183	You know what might also help, constructive criticism and dietary advice. What about healthy recipes being posted or linked to on this sub?	IMP
184	This is a daily occurrence and I provoke it . Don't you worry , I can handle these pussies .	NOT
185	Oh god, the fact that she's using the middle bar to rest her disgusting excuse for a stomach. Gag.	EXP
186	"It's neither angry , nor is it nonsense . Though I can see how being filled with righteousness might make it seem that way . Your mistake is thinking that what you  feel  is right is justified . You're argument is specious . Not only are you blinded by your own zeal ( ' terrorists ' , tyrant ' ) but you are attempting to press your opinion into service as fact . Not only is this incorrect , but it demonstrates a lack of maturity . "" Because I really want it to be so "" does not make it so . Not in this country , anyway ."	NOT
187	"Half the fucking stories in that sub anymore contain something akin to  be me, smallfat but working on it ""I'm fat guys, but I'm totally not like these other fats."""	EXP
188	Thin privilege is being able to distinguish body parts.	IMP
189	Com'on man, thats animal abuse. Fat pets arent cute.	EXP
190	"[ ] ( / lunateehee "" I have no idea "" ) Amazing what Google can turn up ."	NOT
191	I don't know how to answer that question at the bottom It's inhumane for the hospital staff to have to treat them at all but that's not a choice	EXP
192	Wtf do you cut then off ?	NOT
193	"If I had a big enough fat roll that would need a secondary bra I wouldn't be pulling a stupid ""HURRR DURRRRR"" face!"	EXP
194	"How's about ""fluffy"" or ""not long for the world""??"	IMP
195	I would say that he's a troll but time and time again I've been proven wrong by people who are literally THAT retarded.	EXP
196	I can't stand that shit, there is so much that is vegan but unhealthy.  I'm vegan too, but I'm not a fat ass.	EXP
197	Nfl linemen also aren't that fat, they just have a ton of muscle underneath the fat that makes them look like a fat person	EXP
198	No problem frient :) I know you can get really cheap ones on etsy btw	NOT
199	Lol reading the mod story is like reading a lazy mythological tale.	EXP
200	I love nutella and peanut butter like fake reeses.	IMP
201	cries I'mma bigot!	EXP
202	Actually it would be cool for an app to generate a random route.  Riding the same roads does get boring.	EXP
203	sold already sorry :/	NOT
204	My legs used to look a lot like that... When I was a fucking baby.	EXP
205	Nothing says official like a @gmail.com address. They're even too fucking lazy to make a website with hosted email.	EXP
206	I agree . Our secondary and run game will hold us back . We have a potent offense and our pass rush and defense against the run are top notch . I can see us beating a lot of teams like San Fran . But QB's like Rogers , Brees and Brady can do terrible things to our secondary .	NOT
207	"""the gym"" is just another wifi zone"	IMP
208	Props for getting your piss stream in the pic .	NOT
209	And the other people just stand around and do nothing. Guess they're true darwinists.	IMP
210	I bet the one on the right thinks she's hot shit compared to the one on the left!	EXP
211	God that's so fucking sad	EXP
212	I like my meat raw and clucking on the dinner table ;P	NOT
213	"I hated everything about that woman. I found it especially hilarious when even the host was like ""you asked everyone else questions, they answered, so what do you eat?!"""	IMP
214	I'm amazed she found something she could tie around her waist fupa thing.	IMP
215	Scooters aren't normally parked in the middle of the floor, and would be charging at it's station if idle.	IMP
216	You're a fucking tool	EXP
217	NUMBER is probably the weight of one of her bingo wings.	IMP
218	No, being attractive does not magically solve all of life's problems. No shit.	EXP
219	"""I'm a health care educator"" ... You know while its most likely internet PhD talk, as dumb as some of said ""educators"" are I wouldn't be surprised."	EXP
220	The girl is cuter .	NOT
221	Look at those calves. I need some bulking advice from that ham.	EXP
222	Holy shit, damn that's some next level delusion. And I love that doctor, no pussy footing told her straight up that she wasn't counting calories correctly and that no one is going to believe that she doesn't eat anything and can't lose weight because it's physically impossible.	EXP
223	Better yet, just shit straight down a manhole.	EXP
224	Fats are always so crass and disgusting. This isn't cute.	EXP
225	I am not truly serious about this, but ... a little bit, I think. Morbidly obese people should be put the fuck down!	EXP
226	That's one of the best rages I've ever seen .	NOT
227	Being fat is bad, being alchoholic is bad, I'm glad people have finally figured out the first one. Sidenote: Thank you mods for cleansing this thread.	IMP
