	text	labels
4510	and three teeth	IMP
4511	OMG the second from last....I shouldn't have gone back. It will haunt my dreams forever!	IMP
4512	Which chip are you using ? Has it RRODed before ?	NOT
4513	She wouldn't be so bad if she wasn't fucking cocky and super fucking fat.	EXP
4514	It's crazy how you can still tell you're looking at a ham claw even on the x Ray.	EXP
4515	There was some story or show where a ham planet had to be taken to the zoo to use their weight scale. If having to use a scale designed for giant wild animals isn't a wakeup call, I don't know what is.	EXP
4516	Great video ! Thank you for sharing .	NOT
4517	"The text not in bold are Ron Paul's own words unedited . Ron Paul - Bill of rights URL  If anything , the Supreme Court should have refused to hear the Kelo case on the grounds that the 5th amendment does not apply to states . If constitutional purists hope to maintain credibility , we must reject the phony incorporation doctrine in all cases — not only when it serves our interests . The issue in the Kelo case is the legality of the eminent domain action under Connecticut law , not federal law . Congress can and should act to prevent the federal government from seizing private property , but the fight against local eminent domain actions must take place at the local level . The people of New London , Connecticut could start by removing from office the local officials who created the problem in the first place .    Ron Paul lying about the Constitution   The Founding Fathers envisioned a robustly Christian yet religiously tolerant America , with churches serving as vital institutions that would eclipse the state in importance . Throughout our nation's history ,   churches have done what no government can ever do , namely teach morality and civility . Moral and civil individuals are largely governed by their own sense of right and wrong , and hence have little need for external government . This is the real reason the collectivist Left hates religion : Churches as institutions compete with the state for the people's allegiance , and many devout people put their faith in God before their faith in the state . Knowing this , the secularists wage an ongoing war against religion , chipping away bit by bit at our nation's Christian heritage . Christmas itself may soon be a casualty of that war . "" The notion of a rigid separation between church and state has no basis in either the text of the Constitution or the writings of our Founding Fathers . On the contrary , our Founders ' political views were strongly informed by their religious beliefs . Certainly the drafters of the Declaration of Independence and the Constitution , both replete with references to God , would be aghast at the federal government's hostility to religion . ""   Ron Paul on sexual harassment   "" Employee rights are said to be valid when employers pressure employees into sexual activity , "" Paul wrote . "" Why don't they quit once the so-called harassment starts ? Obviously the morals of the harasser cannot be defended ,   but how can the harassee escape some responsibility for the problem ? Seeking protection under civil rights legislation is hardly acceptable . ""   Ron Paul - We the people act   The We the People Act forbids federal courts , including the Supreme Court , from adjudicating cases concerning State laws and polices relating to religious liberties or "" privacy , ""  including cases involving sexual practices , sexual orientation or reproduction . The We the People Act also protects the traditional definition of marriage from judicial activism by ensuring the Supreme Court cannot abuse the equal protection clause to redefine marriage . In order to hold Federal judges accountable for abusing their powers , the act also provides that a judge who violates the act's limitations on judicial power shall either be impeached by Congress or removed by the President , according to rules established by the Congress ."	NOT
4518	because they're sassy loud n' proud nonconformists who won't live by your or society's or anyone's rules. and fuck you for judging them for watching the worst, lowest common denominator reality TV on major networks while maxing walmart brand icecream.	EXP
4519	NUMBER of NUMBER really...	IMP
4520	You forgot cataract, blindness, sweating, vomit and yellow skin.	EXP
4521	Mmhhh mmh that ass girl	EXP
4522	Funding ISIS is just so edgy.	IMP
4523	"I totally missed the ""as if"""	IMP
4524	Report that fucker to the admins.	EXP
4525	I have a ton of coupons , please look : URL Also , I could buy a game for you ( maybE ) I dont want dota NUMBER , only valve complete	NOT
4526	Fat, ginger and bald. This guy never stood a chance.	EXP
4527	My dearest princess will always be beautiful	NOT
4528	using that exact same evidence , you could go the other way ...	NOT
4529	Alright, but the day she dies, we have to have a mandatory day where we just laugh at her.	IMP
4530	in fact all small camps are NUMBER min	NOT
4531	She'd be guessing where it was anyway.	IMP
4532	Sweet jesus it just gets worse as I scroll down.	IMP
4533	I'm going to make a public account on instagram just to follow shit lords and ladies.  Our should we use a hashtag to find each other?	EXP
4534	I thought I'd see more of it here in texas, but most of them here are pretty built in the dfw area.	IMP
4535	"difficult for fatties to get medical attention from the problems they give themselves I thought it WAS difficult, with all that ""my doctor won't treat me"" bullshit that causes fatties to switch doctors until they get the one that doesn't mention weight or weight loss."	EXP
4536	Obama thinks a nice stern letter will fix everything	NOT
4537	They're lazy. Just like fat people.	EXP
4538	Being positive here is a brave feat . Upvoted for courage . :)	NOT
4539	[ I stole it ,   cracker   ] ( / / successfulnegro )	NOT
4540	You are the whale.	IMP
4541	Those ribs look good tho	IMP
4542	Oh my fucking god man I used to be a brony, and looking back the fandom was fuckin nuts.	EXP
4543	"Can't we all just get along? And come together by hating the shit out of our monstrously disgusting ""peers""?"	EXP
4544	What a bitch, I have no idea how you held your temper.	EXP
4545	Oh , CRAP ! Whatever . Happy belated Christmas . Jerk .	NOT
4546	Hot teacher sits on desk and wild fantasy about teacher begins just like in porn videos	NOT
4547	Don't fuck the fats plz.	EXP
4548	How do you handle poe's law ?	IMP
4549	I want to downvote this because that fucking song is gonna be in my head all day...but alas...	EXP
4550	More like Douche	NOT
4551	Virtua Tennis NUMBER ?	NOT
4552	Nah I'd rather be an asshole than fat and hairy.	EXP
4553	The downside is that a lot of the time, these guys end up swallowing the red pill or turning into MGTOWWSBRAW (Men going their own way who still bitch relentlessly about women).	EXP
4554	Yeah I know, there was no excuse for it but I guess I just didn't give a fuck at the time, I am happy I at least prevented myself from getting worse	EXP
4555	What these moron SJWs don't seem to understand is that... if they didn't attack others, they wouldn't be attacked in return.	EXP
4556	Worse? At least they dont smell or talk or post stupid shit on tumblr.	EXP
4557	Where do you think those crop circles come from?	IMP
4558	"To quote Hussie from the notes in Homestuck : Book NUMBER : "" I think a lot of readers have been disappointed that John's peanut allergy never had significant consequences in the story later . Still , as of writing this note , the story isn't finished , so ... """	NOT
4559	That was exactly my thought. Probably weighed itself after a massive shit.	EXP
4560	URL	IMP
4561	Yup. Not sifting through a hour of PBS to find a fatty lol	IMP
4562	This is madness .	NOT
4563	I've heard good things about the m audio bx5a , can you vouch for that ? Or do you have a preference ? I'm liking those even more because I've found them for about $ NUMBER new	NOT
4564	NUMBER-NUMBER Sabres  	NOT
4565	I'll just leave this right here for you : URL	NOT
4566	That's just speculation , in the face of fact : had they gotten the goal , you're looking at a NUMBER-NUMBER loss for England either way . That being said , England's problems are much , much deeper than a goal that they should have been awarded . And Germany , well , in my opinion , they are the new Spain . A relatively young team that is now coming into its time and that I expect to do very well in the coming years .	NOT
4567	Someone stretched a face over a basketball!	IMP
4568	Weird how ?	NOT
4569	Check the notes though. Half of them on that stuff is usually people losing their shit over the picture.	EXP
4570	""" Mr . Mittens has the floor "" "" Thank you Chairman Meow , now regarding the issue of our food-delivering human ... """	NOT
4571	When I chose to be a werewolf , it was one of those moments that deserved chanting and dramatic music . Aela drained her blood into the basin in the Underforge and I took it greedily . Then , I turned into a Werewolf . I can turn into a werewolf at will , but other then that , and the odd woman remarking about the sexy fur coming from my ears , nothing . I really wanted being a werewolf to actually make a bigger difference than it did .	NOT
4572	Rule NUMBER. Also don't flood that sub with anything.	IMP
4573	Right? But when I post a photo of my thin self in lingerie, I'm just being a slut or an attention whore	EXP
4574	NUMBER coal	NOT
4575	Yeah, pretty sure you're a shitty troll	EXP
4576	What kills me is that the things she was doing before is the normal shit you should do for your body!	EXP
4577	[ This ] ( URL should point out the difference between a conservative and a liberal , and how its not racist for a conservative , but for a liberal what they believe , and if you tell a liberal what they believe , a liberal will call you a racist .	NOT
4578	one of the very few perks of the job I'm afraid	NOT
4579	"disagree. maybe the OP, but the other people saying ""HAHA SHE'D BE LUCKY TO GET RAPED"" is not ""making a snarky joke"", it's ridiculous."	EXP
4580	"It may be internet censorship ... but the reasoning  is  pretty solid :P Doesn't the united arab emirates block all sorts of sites ? I didn't see people crying in r / atheism about it then ? Just wanted to point out that you're pissed about them blocking this subreddit rather than internet censorship . "" Internet censorship "" is just a hot phrase being used as a segway in this case . Tl ;d r : atheists can be just as petty as theists . Where is the "" who the fuck cares ? get off my main page ! "" religion ?"	NOT
4581	I didn't know there was a FPHgold! Sounds like heaven, a little piece of ham free reddit  :)	EXP
4582	How did that shit get NUMBER likes?!? Things like that should not be encouraged.	EXP
4583	This moment will stick with those kids forever.  If only they have good shitlord parents who'll explain why these blobs are so fat, the kids will never do the same.	IMP
4584	Hehehe love the poem Rock on	IMP
4585	Air . We'll all be breathing through tubes of liquid nitrogen , flailing around on flapjacks and shooting bubble gum out our noses !	NOT
4586	> Really ? Merriam-Websters dictionary is what you filter theological ideas through ? I don't have any theological ideas seeing that I don't believe in theology ( being an atheist and all ) . However , when I need to debate the definition or meaning of a word , I find Merriam Webster a good source to reference . If you'll look closely , there are three definitions given for magic . I'm referring to definition NUMBER . > NUMBER a : an extraordinary power or influence seemingly from a supernatural source I find this an adequate definition of how christians describe the powers of Yahweh . Not a strawman . As for the zombie bit , if you were intellectually honest you'd admit that the ' full likeness ' claim is the ONLY thing your argument has going for it .	NOT
4587	It's always makes, though. A female awoke and high bmi is really, really rare.	IMP
4588	Blubber mountain and whalelephant (whale-le-phant) are ones I don't see mentioned often but I like.  Edit: Cheese hog.	EXP
4589	He had a hair transplant to fix his weird receding hairline (sorry for daily mail link): URL	EXP
4590	People like the idiot on Facebook that made that pic aren't supposed to understand memes . That's part of what makes them funny . As long as those people stay off reddit and stay on Facebook , I'm happy . From a redditor's point of view , facebook is for viewing idiots in their natural environment , filled with other idiots .	NOT
4591	URL	IMP
4592	Quintisential hipster husband.	IMP
4593	Capri pants, shorts for slobs.	IMP
4594	Don't want to give specifics on the project since I think no one else has done it before , but imagine it's one of those cameras strapped to a seal or penguin . That is why I can't change it .	NOT
4595	Korea is not a direct threat to Israel .	NOT
4596	I ham far exceeds weight limit.	EXP
4597	BECAUSE SHE'S NOT OBESE SHE HAS CONDISHUNS AND GUHNETIKS SHE'S HEALTHY STOP BULLYING U SHITLORD.	IMP
4598	I need muh scooter first	IMP
4599	Tank tops are fine. It's the fatties that should be illegal.	IMP
4600	Something like BBW doesn't exist. Unless they mean big blue whale, but I doubt that	IMP
4601	hey quit being a faggot	EXP
4602	She looks like a pig, apparently can't figure out how to do anything else with her makeup, has a shitty attitude, and somehow thinks that shoving her phone up to her nostrils will a)hide her fat and b) make her look attractive.	EXP
4603	I was shot NUMBER times in the leg , hit with a baseball bat to the head twice and had NUMBER fingers broken .	NOT
4604	Give me NUMBER fucking step. Just one!	EXP
4605	You can buy nicotine patches as a kid ? What the fuck !	NOT
4606	"I saw this in a article about this girl and it said ""Despite her hefty frame, Ms Rachdi says she has always eaten healthily - and puts the excess pounds to eating more healthy food than she should"" Pull the other one love. Its got (Taco) bells on."	IMP
4607	We're screwed  Leggit 	NOT
4608	"Same . I've never audibly agreed with an article before , but i said "" Yes , "" and "" Exactly , "" several times out loud ."	NOT
4609	Who wore it better? URL Nsfw (original post and link)	IMP
4610	Link ?	NOT
4611	My mom also lacks a social filter for my business . She sees nothing wrong with sharing my life with complete strangers . I suspect it's because she's missing the line that clearly defines her and me . For example : I was in my mid-NUMBER's and had recently been diagnosed with endometriosis . It was a big deal to me , so my mom immediately starting thinking that maybe she had it , too . ( This is a common habit of hers and still continues to this day . ) We were standing in line for something when a teenaged girl in front of us complains to her mom that she had cramps and wanted to go back to the car . My mom's bat hearing kicks in , hears this , then loudly announces that her daughter ( me ) has endometriosis , too ( the girl didn't say that ) and that her daughter gets really bad cramps . Erg . The girl is stricken with embarrassment . You would think the mother would be as well , but apparently my mom stumbled across a kindred spirit . The two of them start loudly discussing their respective daughters ' menstrual histories . Fuck . Me .	NOT
4612	If it were to change its name, call it /r/TessMunstersInfluence	EXP
4613	They forgot they put it on there the first time .	NOT
4614	Because she had to suffer nausea all weekend because of the attack.  Clearly the girl deserves to have much worse than that misdemeanor charge	IMP
4615	BBEELLLYYY   !	NOT
4616	Right?! I am now subscribed.	IMP
4617	Haha yeah I got sick of deleting several hundred pictures and I gave wanted to live without for a long time but I kept it for her .	NOT
4618	Seriously.	IMP
4619	Not an MD, but I've been in a gross anatomy lab while med students were dissecting, and it's disgusting to see the amount of pure fat they have to hack their way through just to get to the organs of some cadavers.	EXP
4620	I bet she wont actually share her snacks.	IMP
4621	Why not fire up a virtual machine with Wheezy and give it a go ?	NOT
4622	Holy cow . I found out how to win the steam contest .  Just buy every single person's wishlist down to NUMBER so that they have < NUMBER games come Jan 2nd .  It can't be more than the value of the grand prize . > _ >	NOT
4623	Nobody wants to hear the truth man. They just want feel good platitudes and bullshit.	EXP
4624	"why the fuck would you feel the need to advertise your mental condition on a fucking t shirt? it reads to me ""I NEED ATTENTION PLEASE GIVE ME ATTENTION"""	EXP
4625	Check the Georgia straight . Stay local , cabs will be impossible to find .	NOT
4626	Holy crap those shitlord comments are gold.	EXP
4627	You go now.	IMP
4628	Presidents can repeal or amend legislation ?	NOT
4629	She went from a solid NUMBER to a would not fuck on my drunkest of nights. Pathetic.	EXP
4630	"""I want to get laid but I know no one wants me so I'll just pretend I'm not interested in order to keep my feelings from getting hurt."" -Fatass"	IMP
4631	That's the smug look of a man that knows he's going to collect a life insurance payout in the next NUMBER-NUMBER years.	EXP
4632	Don't aim at the I Beam . Aim between the I Beam and your main reticule , under or lower center depending on situation .	NOT
4633	False. Your fat makes you feel fat.	IMP
4634	Haha I just noticed that's you. Hi.	IMP
4635	Well if she's the typical fat sympathiser  she'll believe that fat people get fat from medicine or spraining an ankle and one week of not walking will make someone fat.	IMP
4636	My husband and I ride . I just started last month . He's been riding for years . He just got back from a great ride . Yes , it's wet . If you're not comfortable in that , don't ride . If you are , then you're golden . Yes there are hills . There are routes so that you can avoid the worst of the hills for either lights or rain . If all else fails , there's a great bus system in place . I'm still pretty much a fair weather rider , but I've been out a bunch of times since I got my endorsement last month . Even several times this week . I got rained on once , but I have waterproof gear , so I didn't care , other than being my first time in the rain . The other drivers around here seem to be ok with cyclists . At least I haven't noticed a problem yet . But even when driving I like Seattle drivers . However , we moved from NC three years ago where you need to develop a sixth sense against the idiocy of driving there . So  anywhere  seems tame and normal after that for NUMBER years . People use turn signals here to indicate a turn . Other drivers see that and respect it . There are far fewer tailgaters here . The pace is generally much much slower , about the speed limit rather than NUMBER mph above it . The roads are noisier , though . There are quite a few Seattleites over on / r / motorcycles . So you can pose your question there and get a much more rider centric view on it . I haven't ridden anywhere else , but I like riding here . So much to see and do , fun roads and straight roads , highways and country roads . My husband likes to drive up to the mountains , turn around and come home .	NOT
4637	It's my favorite kind of chocolate. I could see why you wouldn't like it though.	IMP
4638	""" Burning an American flag is not a crime , but police charged the men with the careless use of a fire because they didn't use a fire pit "" wonderful . good thing the cops are defending the flag and all it stands for . like freedom of expression ."	NOT
4639	Oh god , there's a reason I have such low playtime on scoot !	NOT
4640	Buddha Don't get me started on that fat fuck.	EXP
4641	The amount of time it took to write up all those excuses, she could of cooked enough meals for an entire month!	IMP
4642	NUMBER coal ?	NOT
4643	There are no statistically significant effects of artificial sweeteners on insulin, so far: URL If there was an effect, then yes, it could make people hungry, as insuling shuts down the release of fat from fat cells, which makes blood sugar crash.	IMP
4644	Nice. (I actually searched that hashtag, that's a good one to have trending).	IMP
4645	It may just be me . But if I am giving something away , I will do it my way . It just seems greedy to complain at all , about time it was up , or anything when it comes to getting free stuff . This reddit is great . A community of giving is great . But for anyone to complain about not getting free stuff is greedy . I gave away some coupons earlier , but should I ever be giving away a good game or something , and I am going to be looked at negativly for not following some time limit rule , then I will give it away on another sub , and not hear complaining about something stupid such as time it was up . Be greatful something is being given away at all , and let that person give it away when the deem it appropriate .	NOT
4646	Never fear They'll just lay off some nurses to pay for it	IMP
4647	Damn...that's way better	IMP
4648	I have to agree . He was barely intelligible whilst talking out of the side of his face . I appreciate that he has had a difficult time with his stroke but for the love of God , can't Ryan Seacrest hold a show ? Can't they get a little more recent performer to host the show with him ?	NOT
4649	Whether or not it's a condishun doesn't make it any less viscerally disgusting to me.  Instinctive revulsion isn't based on that kind of morality.	EXP
4650	Saw it twice and loved it	NOT
4651	Fat privilege is having two sets of tits.	IMP
4652	Bariatrics.	IMP
4653	 But you can be fat and fit?! Or some other bullshit response )	EXP
4654	I'm incredibly curious about what kind of place you were in that would have this shit hanging up on the wall...	EXP
4655	My wife is watching a movie , I am watching Dexter . We chat the whole time . We are sitting three feet apart , and got a little bit of liquor .	NOT
4656	interesting , maybe he was texting someone else that orchestrated the robbery ?	NOT
4657	My new goal is to turn a ham planet at the gym into a shitlord	EXP
4658	Good ! That's been my discovery ; usually I don't have any regrets about dropping people who make me feel bad about myself .	NOT
4659	Every time I see the expression and chins on that red lipped sack of shit, I fantasize about strangling her to death (wearing gloves gag). She looks so murderable.	EXP
4660	I assume the student was a lardo	IMP
4661	Done !	NOT
4662	URL	IMP
4663	People get jealous of those better than them.	EXP
4664	Mayonnaise in a fucking jar is considered a fucking snack on the fucking go by that disgusting fucking woman...I gagged.	EXP
4665	I'll just check for an Adams apple to determine the gender... Oh...	IMP
4666	....dust?  Edit: OH.	IMP
4667	I have no idea what would compel someone to pose with a gorgeous atomizer perfume bottle and pretend to be spritzing some into their mouth.	IMP
4668	Don't ever move to New York .	NOT
4669	That has to be one of the UGLIEST humans I have ever seen.	IMP
4670	as fresh as a month old tomato that was left in the sun I laughed so hard at that! This guy is truly gross.	IMP
4671	At least you'll know what's for dinner .	NOT
4672	I'm human, this is scary	EXP
4673	"These responses are damn good , but there's one gaping flaw ; how in the HELL am I going to talk to her , after basically months of little to no communication , just like that ? I think I just may have a decent solution , but by all means , give me some other ideas . Anyway , here's my thought ; WHAT IF I were to say something in the most casual , casual tone possible when the room is very quiet after class and everyone's pretty bored ? Then it wouldn't really seem like I'm crazy interested in her right now - - it would seem just like I was trying to be polite and maybe quell the silence by "" saying something to that one girl I never talk to "" . Devious , right ? Any feedback ?"	NOT
4674	They expected it to give them a magical solution to lose weight without actual work, probably.	IMP
4675	It seems to be becoming a more and more popular opinion on reddit now.	IMP
4676	[ / r / circlejerk ] ( / r / circlejerk ) exists for a reason . Can't things like this go there instead ?	NOT
4677	I always see the posts here with hams hands and it occurred to me one time that they were almost penis sized.	EXP
4678	[ tower of gay ] ( URL	NOT
4679	holy fuck is that how 'gouche' is spelt?	EXP
4680	I see what you did there	IMP
4681	Yes, because she is powerful enough to change free speech and all that other crap....like....the truth.	EXP
4682	"""Dieting is self harm.""  what a dumb fat bitch"	EXP
4683	Lots of video game items ( my main shop theme ) plus a few year end clearance items like my old line of soaps , and some supplies too !	NOT
4684	And frankly , all this saves taxpayer money . They spend 60k on this and then have fewer people in the hospital on the governments dime . It's the equivalent of giving out first 60k worth of first aid kits , which will prevent 500k of costs on our provincial healthcare system because people don't have to go to the hospital as often .	NOT
4685	I agree with the remakes for games that didn't necessarily sell well the first time . ICO + Shadow of the Colossus comes to mind . They didn't sell well despite being such incredible games . A lot of them are cash grabs though .	NOT
4686	Or he has shitty well water.	EXP
