	subreddit	text	labels
0	fatpeoplehate	"The shocking thing here is there are people who have had BMI's of over <NUMBER> ... Seriously , how fucking fat and disgusting can someone get ? The actual medical term they're using for those people is "" Super super morbidly obese "" . So fucking fat they need <NUMBER> supers to describe you ."	EXP
1	fffffffuuuuuuuuuuuu	it's ok , they usually stick to the machines . Squat racks are empty year round	NOT
2	AskReddit	Not me but this guy at my old church in my youth group was caught by my youth pastor having sex with a random non church going girl behind the church one day . The youth pastor talked to him about it and the dude had the balls to keep coming back to church and all other meetings like bible study and act like nothing ever happened and then ask out my little sister . Oh HELL NO . Few people knew about it despite it being a small church . This was back when my parents dragged me to church , which obviously was a great experience . ( sarcasm )	NOT
3	uncensorednews	But a white billionaire evading taxes doesn't get you guys riled up . This is the most hypocritical bullshit I've ever seen . Fuck the direction this sub has taken .	EXP
4	gonewild	What kind of depraved fucked up shit do you do to get your asshole that loose	NOT
5	fatpeoplehate	One thing that Fat Acceptance and HAES has proved is that stupidly can be very contagious .	IMP
6	fatpeoplehate	Yeah , coming from a family with enough money to set you up for life . I feel sooo bad .	IMP
7	space	Don't hold your breath . The Chinese are planning a couple more test modules before launching a full space station in the 2020s , about <NUMBER> years after Skylab . It'll be half the size of Mir and <NUMBER> / 5th the size of the ISS . They're planning an unmanned landing on the moon , and some deep space probes .	NOT
8	mylittlepony	"I feel like the words "" friendship "" and / or "" magic "" should be in here somewhere . Most of the Elements of Harmony keywords appear in the standard-transformation-sequence dialogue , but I would have been much happier with "" By your magic combined ... I am Captain Friendship ! "" That said , this is still awesome-looking and funny and a good parody . Upvoted . :)"	NOT
9	malefashionadvice	So up another button on your white shirt	NOT
10	uncensorednews	I ’ m not sure why this writer has used this headline ? There is nothing in the bill about hurting people ’ s feelings . The bill has added gender expression and identity to the list of classes explicitly protected in the Canadian Human Rights act , and as such has two main purposes : firstly it says that you are not allowed to discriminate against a person on the basis of their gender or gender expression / identity . Secondly it says you cannot incite hatred or genocide against because of their gender expression / identity . Nothing particularly outrageous , nothing about hurting people ’ s feelings . I mean it ’ s sad that this law even has to exist , because in order not to break it all you have to do is behave respectfully and without prejudice towards your fellow humans ... and hopefully that ’ s something we ’ re all capable of and motivated to do anyway !	IMP
11	ucf	It may have something to do with our exclusivity . That said , I was thinking just yesterday that I have no friends & that I should get into animals , because I loved Akira and what little I saw of Full Metal Alchemist . In the interest of full disclosure , I should point out that I am not currently a student at UCF , but am a lowly community college student looking to use a transfer associates loophole to gain admission to the engineering department at UCF . That said , I have a lot of courses to take before I go move to UCF .	NOT
12	SteamTrade	Want Left <NUMBER> Dead GOTY for <NUMBER> coal ?	NOT
13	gaming	"It's not as easy as that . If someone opened the "" Star Wars Cafe "" , clearly catering to Star Wars fans , that would be blatant trademark infringement despite being a different industry ."	NOT
14	milliondollarextreme	""" subhuman niggers hurt society "" - bugman"	EXP
15	uncensorednews	Sharing their culture , I see .	IMP
16	fatpeoplehate	We shouldn't have to make new things . Fat asses should just stay in their own shitty places .	EXP
17	fatpeoplehate	Thank you I don't have facebook , twitter , etc . , but I'm always very very inspired by fit , beautful girls on IG , the fitspo subs here , and ESPECIALLY by the ones who are brave enough to publicly fight back on social media and have their endeavors showcased here on FPH . I feel at home here with other shitladies . In fact , your name is already orange , I must have noticed you were a verified shitlady some time back an added you to my friends list Sadly , for ever one fit girl who shares one picture , there are a dozen fatties posting pictures every day :/	EXP
18	milliondollarextreme	Please stop	IMP
19	fatpeoplehate	that's what my sister says , too . I'm on this subreddit so often , it's easy to forget that many people don't subscribe to this HAES nonsense .	EXP
20	politics	No , read it ...	NOT
21	fatpeoplehate	That's because they're weaboos . You however spent time practicing an integral part of their culture not watching shitty cartoons and eating shitty biscuit sticks .	EXP
22	milliondollarextreme	Sounds reasonable tbh . These are interesting times , and by interesting i mean really fucking gay	EXP
23	SteamTrade	Sorry , already have an offer of <NUMBER> coal . Also , I'd prefer something from my want list , not more coal . Thanks though !	NOT
24	wrestling	"When they are locked around your hips the best thing to do is turn your hips slightly so that yyour right hip or left hip is jutting forward a little bit and then work on the hands and more hip seperation . If you continue to have trouble with this work on doing a standing switch , this was always my go to move and it is easier in my opinion . I used to do a quick stand up and go straight to a switch . When I say "" on your toes "" it should be at almost all times . When you are on top especially . When you are on top you want that guy to carry all of your weight at all times . If you are on your knees he is not going to be carrying your weight . When you are trying to do the pancake or cow catcher you need to get the guy moving . You have to get the front head lock and keep ripping or pulling the guy down and to your toes as you sprawl . When he fights that he will pull his head and body up , and that is when you throw the pancake . As you wrestle better and better competition you will be less likely to hit this move though . If you haven't checked it out go to www.flowrestling.org . There are tons of instructional videos and videos of the top wrestlers in the country . Good luck"	NOT
25	milliondollarextreme	teenagers on first dates kek does this come from experience ? certainly reflects my own	IMP
26	politics	Democrats : - yes to foreign wars - yes to drug war Republicans : - no to bringing troops home - no to getting rid of drug laws	NOT
27	milliondollarextreme	what happened to her knee ?	IMP
28	fatpeoplehate	Thanks for spamming me with like <NUMBER> replies . Don't really care , lifting isn't my life . I have a career and other shit to worry about . Anyway you look like some weird gorilla creature .	EXP
29	uncensorednews	Seriously man . Fuck the ACA and Democrats for deciding they know what I need to spend my money on better than I do . Im young and in good health , im not paying almost $ <NUMBER> a month for insurance I'm most likely not gonna need . They already take a third of my money to waste on dumb shit I don't agree with , they don't get to make up more and more taxes that I have to pay so other people can get shit for free ... fuck im getting sick of this bs	EXP
30	milliondollarextreme	Its a great song	IMP
31	mw3	Yeap , I loved this thing . I played with it for the short while until I prestige'd for the first time , and can't wait to get that thing again . Although I do love getting <NUMBER> + assists every game just for flashing around at choke point .	NOT
32	todayilearned	I'm <NUMBER> try again pup , and I don't subscribe to this neo-liberal bullshit . Dick at birth = male end of discussion .	NOT
33	pics	somthing somthing pants party ..	NOT
34	uncensorednews	It's important to recognize those who were murdered , but the submission title isn't the place to do that . Please only copy + paste article headlines .	EXP
35	truegaming	fallout <NUMBER> made up for the dice by giving the community tools to create . Which ended up ripping out the dice .	NOT
36	Minecraft	<URL>	NOT
37	uncensorednews	I am not deciding Sweden is in decline . I am noting patterns which exist and are undeniable to those looking at it honestly and with an open mindset . It's not one anecdote either . It was one person who would know reporting what they are seeing . And your numbers don't say whom it is committing these rapes . You didn't actually counter what she claimed .	IMP
38	uncensorednews	Wait until Facebook censors someone with real money in the US . Then the shit will really hit the fan .	EXP
39	atheism	THERE IS ONLY <NUMBER> STARS . BLASPHEMY	NOT
40	gadgets	I hear Oceans Marketing is looking for new clients .	NOT
41	fatpeoplehate	Wrong , Baymax is a swole mother fucker , he's got like <NUMBER> % body fat and lifts all kinda shit .	EXP
42	SteamTrade	Beats Hazard for <NUMBER> ? :D	NOT
43	sjwhate	If they were black , no one would give a flying Fucking damn . I hate the double standards and bullshit hypocrisy of the left .	EXP
44	milliondollarextreme	no . makes me feel good and not good as in hedonism	IMP
45	trees	yes this needs to happen !	NOT
46	religion	Likewise :)	NOT
47	fatpeoplehate	Yes ! I'm female and all ladies ' jeans seem to be funnel shaped . If I can find something that fits the thighs , the hips will be loose and the waist will practically be falling off . I Should not be able to remove jeans without undoing the fly . Men's jeans actually fit a bit better which is insane since I'm not at all masculine . Proportions have changed on clothing .	EXP
48	funny	The animation is pretty much flash quality . I prefer Spongebob .	NOT
49	fatpeoplehate	In case you missed [ the last set ] ( <URL>	IMP
50	pics	yeah , I'm really curious as to how this wonderfull beverage is made .	NOT
51	fatpeoplehate	English was never my best subject .. More of a maths gal lol but oh well :P	IMP
52	fatpeoplehate	That pun was dolphinately awful . But hey , it's ok to make puns just for the halibut .	EXP
53	AskReddit	"I live in the city , so I have a lot of them . One day I was walking down the street and this homeless guy , instead of asking for change , just goes "" Ah , you're wearin ' beach colors "" The best times were with my boyfriend , though . The first time he came to the city we were walking and a homeless guy said to my boyfriend , "" You guys are a great couple If you wrote a book , I would buy it . "" Another time , a homeless guy who was peeing in an alley said "" Y'all still looking great together ! "" and then later tried to pass us saying , "" Man , you in my way , but you got a fine girl . "" ETA : One time this older non-threatening seeming woman came up to me , looked me straight in the eye , and goes "" Are you fucking with me ? """	NOT
54	boardgames	Exactly . Make it so they are picking things that you also benefit from . And set yourself up so the roles you pick aren't helping them as much . Pick builder when they are low on funds . Pick Captain if it forces them to ship a barrel they were hoping to trade .	NOT
55	trees	I didn't say that none of them would care , but it has become more and more clear to me that a lot of people these days realize that smoking weed isn't a big deal and won't freak out if they know you smoke . To be fair this is almost definitely dependent on where you live and what the culture is . In the context of the comment I was replying to if someone knows you smoke and you don't realize that they know then it probably doesn't matter to them or they would have made a bigger deal out of it .	NOT
56	zelda	They are officially licensed games . They just weren't developed by Nintendo .	NOT
57	uncensorednews	If the news was just breaking when you posted what evidence do you have that CTR was doing anything ? I think your emotions are getting the best of you .	IMP
58	uncensorednews	"Where be those feminists who protested those "" misogynistic "" male on horse statues ? Why is it a male reporter who wrote this piece ? ... sexual abuse from newly arrived migrants is not only prevalent in schools but that victims are accused of being racist if they speak out . Lol those migrants prob learned to use the "" racist "" card by observing how females in the West use the "" sexist "" card in the oppression olympics totem pole ."	EXP
59	IAmA	It was a different woman than his current girlfriend / possible wife .	NOT
60	milliondollarextreme	If you listen closely to the tape you can hear a few producers oy vey shut it down	IMP
61	Rateme	That makes complete sense . Thanks ! :)	NOT
62	funny	Keep trollin ' , trollin ' , trollin ' ...	NOT
63	fatpeoplehate	This belongs on cringepics	IMP
64	fatpeoplehate	I think it's more just to find people that understand . She already knows her personal accomplishments are something to be proud of and doesn't need us to tell her . What she does need to hear is that she is not alone , we all face similar stuff whether we have a serious condition or not . Even if it's just that we never have to work to look the way we do . ( Surprise , you actually shouldn't have to but people are fucking lazy ! )	EXP
65	writing	Probably would have been better without the last frame .	NOT
66	fatpeoplehate	"I love reading about thin privilege . Every time I read something like "" thin privilege is wiping your ass , "" I just smile and nod ."	EXP
67	sjwhate	Step <NUMBER> : be in 3rd world country Step <NUMBER> : get raped	IMP
68	fatpeoplehate	IT TOOK FOUR PARAMEDICS TO LIFT ME UP No surprise there . She probably just absorbed food by osmosis	IMP
69	techsupport	Some extra information : I've tried booting it on this computer and another computer , getting the same results . Coincidence ?	NOT
70	leagueoflegends	Didn't coop come out like half a year ago ? Fuck	NOT
71	fatpeoplehate	How about that fucking planet settles into the mouth of an active volcano	EXP
72	funny	Most of these are a bit iffy , but teenage mutant ninja turtles really has no reason to be on this list .	NOT
73	fatpeoplehate	"Here's the thing that you're missing . There's this huge industry making billions off of ripping people off with junk products that have no science and doesn't actually work . Someone wants to lose weight , they struggle with it , they don't get taken seriously , because everyone assumes that "" they just eat too much "" . Then they get conned by some miracle cure diet , or new-fangled exercise machine and after yo-yo-ing a few times with half a dozen attempts at getting in shape , their weight keeps increasing year after year . This scam industry creates what's known as "" learned helplessness "" which you can educate yourself on here : <URL> Once your brain has been beaten down enough , you literally give up on trying anymore . It's a biological process . And that is what these greedy assholes selling miracle cures are doing to real people who do want to lose weight , they just think that they are broken and can't lose weight . Contrast to someone having a weight problem , going to their doctor and asking for help , and then having their insurance cover some kind of treatment plan that is based on science , having their friends and family support them getting healthy instead of acting like they're just intentionally trying to kill themselves , with treatment aimed to manage and cure the disease , instead of simply exploiting them emotionally to milk money out of them . I challenge you to really reconsider your viewpoint . I don't think these whiney ass tumblrites who call themselves "" feminists "" are helping anyone by pretending that having a penis is equivalent to being a rapist . However that doesn't mean that men and women having equality is something we shouldn't strive for as a society , when you have women in some countries not even being allowed to drive cars because of their gender , or parents drowning their newborn girls or giving them sex-changes because of just how much better men are treated by their cultures . My point being , you can't ignore the problems of the many because a few assholes are going around suing the airlines for having to pay for two seats ."	EXP
74	gaming	Seriously , if this grows at the same rate Minecraft did it'd be insanely awesome . Hell , i would probably get more enjoyment out of just messing around with the level maker for a year or so .	NOT
75	fatpeoplehate	Looks like one case that came into the morgue once . I wasn't there to assist in the autopsy but got the laundry . The jerk pathologist did the post on Friday and chucked the gowns and stuff into the laundry bin , which I got to on MONDAY . Ugh it was gross . Loved that job though .	EXP
76	WTF	clever	NOT
77	milliondollarextreme	I'd rather Wu Zetian had something to say about it .	IMP
78	atheism	I'm really , really , not trying to be a jerk . A few well placed punctuation marks would do wonders for people attempting to comprehend your sentences .	NOT
79	IAmA	What , if her dad suddenly started manipulating reality like conjuring magic missiles , that would be <NUMBER> % indicative of god's existence ? Even if he claims his magical powers come from god , historically most sorcerers were patrons of some god - Ba'al , Ra , etc . For example , just because Melisandre can see the future in flames does not mean that R'holler exists .	NOT
80	occupywallstreet	Don't Feed the Trolls !	NOT
81	AskReddit	And you wanted to be my latex salesman ?	NOT
82	TwoXChromosomes	Thank you . I'm trying to keep my head up , focus on making <NUMBER> a much better year ( the first year without him ) . We can totally do it Keep up the good work . I'm proud of you	NOT
83	fatpeoplehate	Honey boo boos mom idk her fucking name tho :/	EXP
84	pics	Fat free ? Of course they're fat free , they're gummies ...	NOT
85	fatpeoplehate	I like a story that someone shared once . The basic idea was similar to the sixth sense , where the creepy kid saw fat people , instead of dead people . The twist was that his psychiatrist was actually fat , not a ghost . I've always wanted to see a similar story in novel form . Since I like science fiction and fantasy , I want a story where there is a cosmic / supernatural event that suddenly destroys people's perception / awareness of their own obesity . As these skinny people are walking around , they are starting to notice bad things happening to them . They break chairs , they get stuck in narrow places , etc . The humor would be in the way the world cannot accommodate their expanding hammyness . In the end , they will have to face the fatlogic they have used and repent . Some will hit the gym while others will kill themselves . I like your idea OP , but I dislike stories that become too involved with politics . Utopian and dystopian futures are kinda boring because they have been done too many times . I prefer our own world to change instead of having to set up a half-baked alternate universe ( which goes against most science fiction plotlines , I know ) .	EXP
86	harrypotter	must find every episode	NOT
87	fatpeoplehate	"I can curl up in a little ball and get comfortable in awkward spaces . I have a good relationship with my doctor - no worry of "" fat shaming ' I shop thrift and can shop the S-L sizes , have a bunch of choices and get great quality clothes for cheap , instead of the slim pickings of the plus section . Plus , I fit in actual vintage clothes , not super expensive re-creations People call me beautiful without adding anything else I have never had to worry about a man not wanting me because of my body I don't get jealous of women prettier than me I can fully cross my legs with no fupa / huge thighs in the way I am feminine without having to shout it to people / wear dresses and cake-up all the time Walk all day without exhaustion Plus so much more !"	EXP
88	fatpeoplehate	I don't need any inspiration , I just stop eating once I have had enough food . That's the only thing you need to do to not be a fat fuck .	EXP
89	uncensorednews	yeah it looks like they filled in a bit more but not much	IMP
90	fatpeoplehate	Oh I know . A recent conversation between us went like this : Shitlady : You're lucky you have a thin wife like me . Shitlord : Luck ? Ha ! I'm an expert womanizer . Of course I chose a thin woman to marry . Shitlady : Yeah , but lots of beautiful women get fat after marriage . You're lucky . Shitlord : Yeah , you're right . I'm lucky .	EXP
91	sjwhate	Let's just ban all the words that describe SJWs . Those fucking autistic sluts .	EXP
92	leagueoflegends	A good friend introduced me to it back in late January , early February .	NOT
93	skyrim	lol .	NOT
94	malefashionadvice	Sleeves are really long . If you're okay with a coat fitting like a blazer ( nothing wrong with this ) get sleeves shortened , should be shorter than body lenh . Ideally showing a little shirt cuff when moving . Bottoms are its own thing . Don't pair together .	NOT
95	funny	The cult of Harry Potter has been drawing in people for years in order to serve as Satan's false prophets . What makes you say that ? You don't give any reasons to support your conclusion . I'm not like anyone else , I'm curious why you think this way and am making an effort to understand your perspective .	NOT
96	fatpeoplehate	Clearly your daughter is going to copy your unhealthy habits and develop a dangerous exercise obsession . You probably count calories in front of her too . For shame . / s	IMP
97	uncensorednews	I'll just leave this here to blow your mind . <URL>	IMP
98	AskReddit	Why does that automatically make them attention-seeking [ loud , outgoing type ] Because any man who lacks those qualities won't put on a dress .	NOT
99	milliondollarextreme	But it wasn't banned because of its ideology , it was banned because they tried to dox the guy who punched Spencer .	IMP
100	fatpeoplehate	"HOLY SHIT FUCK ! My arteries clogged just looking at it and my ShitLordBoner popped a little with sheer rage . I bet if we trolled his history we would find evidence of him saying HAES nonsense and he is only fat because of his genetiks — because he usually eats real clean . "" Look at this awesome snack my girlfriend brought me because I had a bad day . So excited to take her to the all you can eat Buffet in an hour after I finish my snack . Love her . Nom nom nom . """	EXP
101	AdviceAnimals	Check	NOT
102	videos	Granny gets mighty upset when her pot of tea goes undrunk .	NOT
103	skyrim	Champion of the sun	NOT
104	fatpeoplehate	bro you dont even gotta look like Adonise to get with pretty girls . I have some muscle definition like OP and girls ( and even gay guys heh ) tell me I'm attractive . yeah we all hate fatties but goddamn us normal folk are turning into unicorns and the people that put the work in are like shiny mewtwo's .	IMP
105	uncensorednews	Many are treating this as an act of war from a foreigner because he he is a muslim radical . But he is a citizen , and this is a criminal act Well shit , that context so absurd that I never even considered it , but now that you mention it I understand . I have yet to see anybody post / say something like that but I wouldn't put it past people who are extremely paranoid about Muslims in general .	EXP
106	fffffffuuuuuuuuuuuu	They definitely notice . It's just an awkward thing to bring to someone's attention . I'm not trying to be a dick but there's absolutely no way you don't smell gross after not showing for a few days .	NOT
107	milliondollarextreme	hes the smart sane one	IMP
108	fatpeoplehate	I took my car into the shop and went to the gym . I felt the same way . I always come in late to these things . The butthurt is amazing to read though . I am supposed to be going to a party with my wife tonight . I should be getting ready but I cant stop reading all the fucking crazy .	EXP
109	treesgonewild	Gotta cup ' em all , PokeBra !	NOT
110	starcraft	Who gives a fuck what local koreans think honestly ? Most of the money in E-Sports is not in Korea .	NOT
111	politics	No reelection vote for Obama , this is a game breaker .	NOT
112	fatpeoplehate	Yeah . <NUMBER> gallons of water weight ... Sheesh .	IMP
113	fatpeoplehate	"I was bullied by the fat girls all through school . My Dad would say "" knock over the ring leader and it will stop "" I was way to passive Then when I got my first office job I thought all that bullying shit was in the past Nope fat adult woman are even worse o . o"	EXP
