	subreddit	text	labels
1996	fatpeoplehate	my bmi is <NUMBER> and i run <NUMBER> . <NUMBER> km in <NUMBER> minutes ... so ... where should i stand ?	IMP
1997	chuck	Alex is such an annoying vagina	NOT
1998	holocaust	Real issue is forensic examination of the alleged murder weapon and logistics of cremation : not practical to exterminate people dumping zyklon through holes in the ceiling , they would have used zyklon louse disinfestation blower apparatus and , Diesel exhaust ( Treblinka ) has inert amounts of carbon monoxide .	EXP
1999	fatpeoplehate	Fucking disgusting and a waste of fucking space on this great planet , she should be ashamed of herself	EXP
2000	pics	Your new years plans are getting rejected ?	NOT
2001	politics	The individual liberty of a corporation ... What ? So corporations are people ?	NOT
2002	fatpeoplehate	There are social events at the local dungeon I go to . The last time I went , all the fat fucks self segregated to the other side of the room all holding their precious white Styrofoam take out trays . Even when the social event was far away from the nearest restaurant , they still all got takeout . I was very pleased that the no food on the couches rule existed , keeping the hams segregated . Slim Jim Crow laws .	IMP
2003	uncensorednews	Call the Police . Tell them you being being held against your will . If that doesn't work , call the fire Chief .	IMP
2004	milliondollarextreme	people placing this much stock into a fucking archetype test are doomed to begin with . Its the same shit as revolving your mindset around being ' gay ' or something .	EXP
2005	atheism	Let me get this straight ... reddit is outraged because the sharia-law practicing UAE has banned r / atheism ? If you didn't believe r / atheism was as uninformed as well as self-absorbed before , here's your proof !	NOT
2006	SteamTrade	How much ?	NOT
2007	milliondollarextreme	ease up with what shit , dawg ?	EXP
2008	fatpeoplehate	My drink normally comes with <NUMBER> pumps . I have to ask for less because it's too sweet .	IMP
2009	uncensorednews	Sweden literally needs a violent revolution	IMP
2010	milliondollarextreme	I heard whey is mostly a scam used by the dairy industry to sell off the waste created in the dairy refining process , and all you need to do is eat a ton and drink zippy water	EXP
2011	politics	It doesn't matter what he thinks ; this is a judicial matter not an executive one . If you are voting for a president soley on the content of their character then ron paul still trumps everyone else regardless of this seemingly backward libertarian view . Sexual harrasment is a form of discrimination and is protected against under title VII of the civil rights act . Ron Paul can't do a darn thing about this . Also this was written <NUMBER> years ago ; lets ask him if he and his views haven't evolved since then . I question how politically informed he was at the time he wrote this . / end apologizing . Not every speck of dirt is a mountain	NOT
2012	uncensorednews	"If murderer = tan : "" man "" If murderer = white : "" WHITE MALE "" within first four words of headline If victim = white : no mention of race If victim = tan : oh boy , time to drag Germans out into the streets for a purgin ' ."	EXP
2013	pics	<URL> <URL> <URL>	NOT
2014	funny	Punch-line in the post title ...	NOT
2015	Games	Hmm , not sure how this game escaped my radar , but I had never even heard of it before today . And already <NUMBER> - <NUMBER> people have suggested it to me . Maybe because I specified L4D ?	NOT
2016	milliondollarextreme	cup cup	IMP
2017	islam	Even though I am an atheist , is perhaps one of the shittiest subreddits around . The only reason I'm still subbed is because it on occasion has something decent as the top post .	NOT
2018	WTF	But what if it's atheist ? Welp , it should know by now .	NOT
2019	funny	"Hey , back to the OP : "" best day of your life , so far "" . Let's hear it for going as far as we can ."	NOT
2020	uncensorednews	Accomplish goals . Don ’ t point to your skin color and brag about shit you didn ’ t have any control in . That ’ s for weak willed fucktards who can ’ t accomplish anything substantial in their lives . Taxonomy classifications are great , but people can breed and fuck with each other and we haven ’ t seen a pure bloodline since before sea travel . <NUMBER> . <NUMBER> % of a humans DNA dicatate the external traits that we use to define race . Race is a horrible and incomplete taxonomy when we are at a time in human history where we ’ ve mapped the genome . This debate is dated and silly .	EXP
2021	fatpeoplehate	ah chris chan . last I heard about him he pepper sprayed a gamestop employ because sonic's arms aren't blue anymore .	IMP
2022	sysadmin	No , they keep it pretty secret .	NOT
2023	gaming	<NUMBER> <URL>	NOT
2024	sjwhate	Fuck that rapist , Clinton loving , pedophile , piece of shit .	EXP
2025	sjwhate	China ?	IMP
2026	AskReddit	I had no problem with dating a mom , but the fact that her kid was awake in a room less than <NUMBER> feet away is kinda tough .	NOT
2027	socialism	How will workers take over the means of production while the existing institutions , namely laws that protect property , a staple of liberal democracies , and the repressive capitalist state and police force ? How do we kick out the fat cats while every institution is made to protect them ?	NOT
2028	milliondollarextreme	imagine having to try and conduct an interview with sam hahah	IMP
2029	milliondollarextreme	this comment is rude but i wont downvote you , but next time I will	EXP
2030	photography	Thanks alot that's what I wanted to know :)	NOT
2031	sjwhate	Can we sperg out even if we don't think this is coontown ? Please ?	IMP
2032	askscience	I don't recall the experimental data confirming the existence of virtual particles . Infinite virtual energy would only be possible for an infinitely short time interval , presumably .	NOT
2033	politics	Obama thinks a nice stern letter will fix everything	NOT
2034	AskReddit	cigarettes	NOT
2035	starcraft	"I see this a lot , especially on forums outside Reddit . It's particularly a problem with newer players , IMO . They come to a forum looking for advice or trying to discuss something , and get jumped on and put down for making a mistake or not realizing something . "" lol lrn 2macro noob "" , "" your problem is you have the mechanics of a retarded monkey "" , "" bronze league confirmed "" , etc . I see comments like these all the time on pretty much every forum . If you're not going to say something constructive to a player who is less-knowledgeable than you , then don't post ."	NOT
2036	milliondollarextreme	with all that production value i would've expected them to get the girls little monologue at the end right :	IMP
2037	Feminism	Nor a true Scotsman ?	NOT
2038	fatpeoplehate	Those pictures gave me diabetes . JFC , how much goddamn sugar can you eat ? Doesnt her stomach hurt after ingesting all that shit ? The berries thing pissed me off the most . You know she sprayed some directly in her mouth before AND after burying her fruit . RIP berries .	EXP
2039	milliondollarextreme	""" I'm more successful than tim "" . So that confirms that he only cares about how he's seen rather than his art and what he makes of it ?"	IMP
2040	fatpeoplehate	"Exactly . Like , this is what I expect my four year old cousin to do during her ballet class . She jumps up and down and flails , and it's not really right , but you tell her , "" I'm proud that you tried hard ! "" and it's okay because it's a bunch of fucking four year olds . This gif is just embarrassing . [ Meanwhile , an actual adult ballerina performs as Odile . ] ( <URL> EDIT : I just saw your username . That is hilarious ."	EXP
2041	fatpeoplehate	I didn't read the article . I do belive in the eating more to weigh less . Usually it's some stupid girl eating <NUMBER> calories a day on mfp . They get lethargic can really do anything and are going to get an ED . It's not starvation mode . But they do start messing their metabolism . Slowing it down . In that case eating more will put them back on track with maybe <NUMBER> - <NUMBER> % below TDEE . Also it's a good jumping board to tell them they get that little pooch tummy at low weight and gaining <NUMBER> pounds with heavy lifting will make it go away . Not that your <NUMBER> lbs so eat a ton of pizza to lose . Edit : I went and read it now . I don't think those people are talking about the same situation I am . Durp .	EXP
2042	soccer	Should retire when he can to leave his legend status . All downhill from here . If he sticks for <NUMBER> - <NUMBER> years he's gonna leave them as relegation contenders .	NOT
2043	milliondollarextreme	Conservative career troll . She gets trotted out for interviews where she talks about how she thinks Sarah Palin is the smartest feminist alive , etc .	EXP
2044	fatpeoplehate	Actually smokers save money on health care because they die earlier .	IMP
2045	fatpeoplehate	You know that you are nitpicking about <NUMBER> - <NUMBER> kilos , right ?	EXP
2046	politics	Do you think the republicans would have not funded defense if Obama refused to sign the bill with these crap provisions ? He could have easily gotten around this and the fact that he didn't even try is disgusting and pathetic that he tries to blame others when he does sign it . Hope and change ? Or more of the same ?	NOT
2047	malefashionadvice	Here is [ mine :] ( <URL>	NOT
2048	fatpeoplehate	I have a friend from midwest - her whole family looks like a flock of [ cranes ] ( <URL> they are so skinny . But they are always posting on Facebook the most outrageous things I've ever seen . Desserts made of snicker bars and cool whip . Casseroles with corn flakes and mayonnaise . She messages me the best ones , just to freak me out . She says it's a midwest thing .	EXP
2049	fatpeoplehate	I would say it would be terrible because a good third of the movie would be taking a break to eat trail mix . With the raisins removed . And the peanuts . And the almonds . And the granola . M & M's . It's a break to eat M & M's .	IMP
2050	sjwhate	That's just a black person acting black . Their are entitled children . Not all black people . But your looking at like <NUMBER> - <NUMBER> % . Immature as fuck then pretending like it's not their fault . This beast should be whipped , told to stay inside if this is how it acts when it goes out . FYI did you know that predominantly black clubs have a drinking age of <NUMBER> ? Why do you think they turn away customers even though its legal to serve them ?	EXP
2051	battlefield3	Can I ask you what program you use to stream ? and if you do anything extra to make BF3 stream ? I can't seem to get it to work , the streaming works fine , but when i go to BF3 , all you can see on the stream is black .	NOT
2052	AskReddit	I discovered my uncles body after he committed suicide . He had not been answering family members calls for <NUMBER> or <NUMBER> days , so I swung by his house after work to check on him . Knocked on the door , rang the door bell , heard his dog bark but no answer . I had no key to his house so I got out a credit card and jimmied the door open that way . His dog seemed frightened . I go through the kitchen into the living room to see him hunched over his couch . He was an alcoholic , so I figured he had got wasted and passed out . I looked through the kitchen one more time to see how many beers he had drank or bottles of whiskey . No alcohol at all . I go over to wake him up and touch him on the back of the neck . Cold , stiff , pale , lifeless . That's when I noticed some blood stains on the couch , a gun to his right and a bullet hole in the top of his head . I was pretty fucked up about it for a year . I still have nightmares about it from time to time but not like the first year it happened . I cry every February 17th ; the day I found him . I have his dog now . Sometimes it almost pains me to look at the dog because it can lead to memories of what happened that day and the condition I found the dog and my uncle in .	NOT
2053	milliondollarextreme	Styxhexenhammer - The daily shoah - Fash the Nation what kind of podcasts you looking for ?	IMP
2054	uncensorednews	Do the Barbies have holes now so they can practice rape ? Oh wait , that would be more of Skipper's marketing angle since she's Barbies underage sister ...	IMP
2055	fatpeoplehate	Skipping rope is the most effective cardio and all you need is a $ <NUMBER> rope .	IMP
2056	atheism	Yet you can still write that post on this website .	NOT
2057	trees	That sucks , have an upvote , my buddies .	NOT
2058	fatpeoplehate	"I've seen mostly the opposite on MUA where fats fill in their brows HUGE and DARK so it detracts from the fat the envelops their faces . They think it makes their face look small . Just like they all do "" contouring "" dark as fuck to accentuate their "" cheekbones "" aka "" fat deposits on the face . """	EXP
2059	sjwhate	"Nothing , i like the constitution . Its just dumb to think itll protect you when the government has proven time and again that it wont if the government really wants to fuck you Also because of all the "" progressivism "" thats turning it shittier with each addition"	EXP
2060	fffffffuuuuuuuuuuuu	that needs a tl ;d r ?	NOT
2061	milliondollarextreme	if you have a shitty life and a shitty mentality I don't care about your opinions .	EXP
2062	AskReddit	That's one of the best rages I've ever seen .	NOT
2063	fatpeoplehate	Whale , Whale , Whale , Whale , what do we have here ?	IMP
2064	fatpeoplehate	Keep it to yourself , toots .	EXP
2065	funny	Thank you much .	NOT
2066	resumes	Sorry meant to reply to op , not to this comment , but oh well :)	NOT
2067	milliondollarextreme	he couldnt trick the bronies with the ol kickstarter scam but he did find an audience dumber than them	EXP
2068	milliondollarextreme	Stop spewing these hate facts you bigot .	EXP
2069	uncensorednews	"You're a fool is you believe any religion does anything "" as a whole "" ."	IMP
2070	milliondollarextreme	If I am to be honest , I defend western civilization but I don't actually think it is better than anything else . I prefer western civ because I'm bias . But if I was a hunter-gatherer , I would think western civilization is retarded . Well , you have to ask yourself what is the most important thing in life ? Sensual and materialistic experience is universal . Knowledge is mostly universal but in varying degrees of compartmentalization . Who you are , as in any definition of your being is in your strenh in overcoming whatever shit comes your way . And so to wonder which conditions are better doesn't really matter , or rather is relative to whatever purpose it has for you . Since we are acting in accordance with self and its inner wants we decide to defend western civ . But that's a matter of mundane maintenance . I'm realizing right now in fact that it would be better to concern ourselves rather with self-improvement . maintenance is all good and stuff but it doesn't make you who you are . Further , the way the ego is a tool , maintaining a harmonious environment is a tool but we can become distracted and miss what the tool is for . We create the harmonious conditions so that we have a home base , a point of departure . We are not meant to just sit in the house we built .	EXP
2071	fatpeoplehate	I don't have a SO at the moment , but this pertains to me feeling that way around anyone .	IMP
2072	fatpeoplehate	I'm newly pregnant with a tiny shitlord . You have no idea the retching these pictures caused .	IMP
2073	milliondollarextreme	he barely mentions the neo-cons and foriegn policy . its mostly that they relentlessly worked to manipulate immigration to fundamentally change the outlook and foundational culture of America to better suit their jewish interest and cosmopolitian bias	IMP
2074	fatpeoplehate	I'm going to slip out of my shitlord shell for a minute and try not to go full tinfoil hat on this place . History books are written by the winners . Don't ever even think for a second that what you read in school , was an accurate portrayal of the events leading up to the present , it wasn't and is almost far from the truth . We're programmed to believe lies and facts of lies all in the name of standardized testing ( yes our education system is fucking grand , isn't it ? ) and its all done with rote memorization until the point we accept it as truth and do no further digging for the real facts . This is our education system and its part of the propaganda machine that has and continues to drive this country into an incoming disaster . This leads me to my next point . We're only focused on the details of our own country , not the details of others . While it was a part of American history , its being taken from the context of America's point of a view , not the Irish or Ireland's . I don't claim to be a history buff but dollars to protein bars , I would say the amount of context we have about history as a whole , is a tiny sliver and is just enough for Americans to slip through school and grow into adults who have little to no desire to learn about history from other contexts . Simply put , those who don't learn history are deemed to repeat it .	EXP
2075	europeannationalism	I'm sorry , but ... WHAT THE FUCK ? ? ?	IMP
2076	fffffffuuuuuuuuuuuu	Everyone knows there is a direct correlation with how many years of jail time you get for slaughtering that living thing and how tasty it is . All the way up to life without parole , those are delicious .	NOT
2077	Drugs	Shulgin's on the list for sure . Probably Alexander Hoffman . Bill Hicks for sure . Allen Ginsberg . Aldous Huxley . HST has just a bit too much machismo for me . ( edit : Had to google Bob Black , but he sounds like a man after my own heart . )	NOT
2078	pics	Stationary Village grew . Julian would be proud .	NOT
2079	uncensorednews	Are you a jew ?	IMP
2080	malelifestyle	disregard champagne , acquire prosecco I <NUMBER> prosecco .	NOT
2081	AskReddit	Depending on one's mood , one could : Pretend to not know English , go stealth mode , act like a deranged lunatic , or laugh . If you have a portable reciprocating saw , you could also cut out the tiles around you , and fall , still on the toilet , to the floor below .	NOT
2082	fatpeoplehate	thin privilege is having your arm look like an arm	IMP
2083	uncensorednews	How is this news ? Aren't there random psychos wielding weapons in the US all the time ? Columbine , Virginia Tech , Sandy Hook , Aurora , etc .	IMP
2084	fatpeoplehate	Ew , I wouldn't even sit next to that Majin Buu lookin ass bitch .	EXP
2085	depression	Happy New Years to everyone ! Will most likely be alone , and if not , I'll only be with a couple of immediate family members . <NUMBER> was pretty crappy , but I'll definitely try to make <NUMBER> a better year , and hopefully others find <NUMBER> to be a fine year for themselves as well .	NOT
2086	Music	Yep that about sums it up perfecrtly	NOT
2087	sjwhate	Now imagine you just successfully landed a multi million dollar craft on a comet and you fart .. and everybody is offended , accuse you that you are probably anti Jewish because you wanted to gas people in that room . Dude how hard could it be to just applaud that man and his team for what he accomplished in the name of MAN KIND and don't give a fuck about what the fuck is he wearing ? What's next ? We care so much about such little things ? ! Really ? I want to believe that's not the case .	EXP
2088	uncensorednews	There isn't anything illegal about discriminating against someones past work experience . In fact it's one of the few legal discrimination which anyone can use . Others being education , accreditations , awards , volunteer history and non pardoned criminal activity . What's really hypocritical is the likelihood that people which worked on Hillary's border fence in <NUMBER> - <NUMBER> are employed there .	EXP
2089	fatpeoplehate	OH THE HUMAITY !	IMP
2090	fatpeoplehate	It means it ate the gym	IMP
2091	Christianity	LOOK , MY COUNTRY IS BETTER THAN YOUR COUNTRY .	NOT
2092	WTF	""" people you may know "" will become "" people who may have done your girl """	NOT
2093	uncensorednews	The oligarchy is left .	IMP
2094	fatpeoplehate	She's a courageous woman who needs no man in her lyfe to tell her she's large and beautiful and that her obesity is only because of janatiks .	IMP
2095	fatpeoplehate	Scumbag fatso	IMP
2096	fatpeoplehate	Hey now , make fun of their disgusting physiques that are their own faults , not the weird mouth that Jesus gave her .	EXP
2097	funny	im australian	NOT
2098	fatpeoplehate	I really don't like cardio . I do it , but I don't enjoy it like I enjoy lifting . I just think running and the like is boring so I normally end up doing jump rope or boxing for cardio .	EXP
2099	funny	Why should they ? Generally , many things on and even are informative and / or interesting . However , most people just end up upvoting stupid bullshit like facebook posts to the top and burying the good stuff . They're fine subreddits , just the popular content is mainly assholery and circlejerking .	NOT
2100	fatpeoplehate	And they always pick the slim / fit character over an obese one . Because that's who they want to be ! Subconsciously , they know .	IMP
2101	nfl	"I'm pretty sure racism covers more than just "" I hate <NUMBER> % of black people <NUMBER> % percent of the time . "" Race was a factor in the media's perception of Peyton Hillis last year , and that definitely had some influence in his inclusion on the ballot ."	NOT
2102	AskReddit	To be able to get a reaction from people without having to deal with the consequences of telling someone your secrets	NOT
2103	uncensorednews	Fighting racism and ignorance with more racism and ignorance isn't going to work . Fuck off back to your bridge .	IMP
2104	AdviceAnimals	My sister is a Junior in College , she says she has seen <NUMBER> black student their in her entire time being there , her college has <NUMBER> , <NUMBER> students ...	NOT
2105	fatpeoplehate	I'll never understand why normal people marry obeasts . Seems like it's so often slim men marrying whales . Why , dammit , why ? I can only assume the pussy desperation has set in .	EXP
2106	gaming	Because your average fps player in the year <NUMBER> ( <NUMBER> ? ) is a <NUMBER> year old who just wants to watch blood spray everywhere .	NOT
2107	fatpeoplehate	i.imgur.com/ZPILv9Q.gif	IMP
2108	nba	that being said , excuses .	NOT
2109	fatpeoplehate	Right ? I think im gonna start practicing shit like this just for the street cred . Or to prepare my self when some fucking land whale gets seated next to me on an airplane and I have to cut off my arm like the <NUMBER> hours movie to free myself .	EXP
2110	amiugly	Well , finally got around to getting it cut just an hour ago so I don't know yet , but definitely appreciated your comments and suggestions .	NOT
2111	atheism	I was gonna say , I wasn't aware Christians were convinced by facebook screencaps mocking them .	NOT
2112	uncensorednews	USC has the <NUMBER> International Business program in the country . It has also produced more Rhodes scholars than Clemson . You are right Clemson is a shit school , but you apparently know nothing about USC . Downvotes but no arguments ? Typical Clempson .	EXP
2113	fatpeoplehate	I want to make this a thing , like in the gym people should say they hit the cardio so hard they went into starvation mode for a second . And a legit hashtag . Cracks me the fuck up .	EXP
2114	milliondollarextreme	shakes head its not ready	IMP
2115	IAmA	"Do you hate your money ? Do you ever / did you ever "" Live poor "" for shits and giggles ?"	NOT
2116	battlefield3	Fact-it takes less bullets to kill in HC . Twist it how you like , facts are facts .	NOT
2117	fatpeoplehate	"It depends on the smell produced by said "" man """	IMP
2118	fatpeoplehate	Can anyone tell me why the fuck her legs are like that ?	EXP
2119	uncensorednews	I most certainly foresee a time in the future when East Europe splits of from the majority muslim west Europe and a possible WW3 scenario I just feel that would be very unlikely , my wife is born in France and lived there for <NUMBER> decades , and explained there is mostly North Africans population from mostly Tunisa , Algeria , and Morocco and they are poor and live in ghettos selling drugs , doing hood rat things etc . Instead of Muslim extremism Id be more worried about rampid consumerism , like how black Friday is becoming a thing . I can only speak for southern France though . I'm personally more afraid of Western Europe losing there wonderful worker rights and universal insurance from the unskilled workers coming in driving down wages which I haven't heard much of because most of them don't work anyways.But I feel that's more likely then thinking shariah law will be enforced . And I feel terrorist attacks are going to continually happen no matter what . It will take a while for the Muslim numbers to climb due to outbreeding and the slow cultural jihad that is taught in the Mosques to have minimum <NUMBER> - <NUMBER> children and to make sure to enter into positions of local government . I spent <NUMBER> minutes looking at wiki for your <NUMBER> - <NUMBER> children , I think that's what you heard or an overexaggeration unless you're confusing your Muslims with Mormons , are they on mountain bikes spreading the word of Allah ? My friend is kurdish and has <NUMBER> kids and my wife has Muslim faith friends who only have between <NUMBER> - <NUMBER> children . I don't know about anything else there , I see no fact checking One day it will be pure hell between the <NUMBER> sides , but I am sure that the rest of the World and its powers will side with East Europe and Russia Y'all are going to be just as divided as East Asia if you dont work out your fucking problems and nip it in the bud , I feel once that Merkel's ugly ass is kicked out , you'll progress a little more .	EXP
