	subreddit	text	labels
1013	fatpeoplehate	I suspect you might be right . Have you reported this to the mods ? User / u / kissmypussydog has already deleted their reddit account . The imgur post was quickly gone too . Was it / u / bricheese <NUMBER> who posted it on their imgur account then ?	IMP
1014	vegan	"Well , eggs aren't vegan . So no , you wouldn't be a vegan , but it's a convenient shorthand for when you're in restaurants . Your chickens are probably not near the top of my list of things to be extraordinarily worried about , but I'm not going to say it's okay either . ( I don't think the eggs or the chickens belong to you , but "" vegan "" and "" humane "" aren't necessarily the same goal )"	NOT
1015	milliondollarextreme	He's <NUMBER> % genius , <NUMBER> % retard , <NUMBER> % ganja poisoned	EXP
1016	fatpeoplehate	I always say Mind over Body . Could be hard for her to have her mind over her matter .	IMP
1017	fatpeoplehate	[ I think she may have been the one that really turned me from someone who hung out here because the people were funny to a proper shitlord ] ( <URL>	EXP
1018	SteamTrade	Ok :)	NOT
1019	fatpeoplehate	Lol I didnt really mean breathe , I stated that in a dumb way , it just looks like she's holding it down because the pressure is causing her chest and throat distress by pushing into it causing a sensation of needing to breathe .	EXP
1020	fatpeoplehate	Yup . And everyone who isn't fat must live on alfalfa sprouts and distilled water . Because there's no such thing as eating bad food in moderation ... I fucking love cake ! Every once in a while . Not twice a day everyday until the cake is gone and then I buy more cake ...	EXP
1021	AskReddit	Fuck a parachute I'm <NUMBER> and a half	NOT
1022	SteamGameSwap	All my coupons : <URL>	NOT
1023	washu	Robbie ?	NOT
1024	AskReddit	No , Strangeways here we come .	NOT
1025	AndroidQuestions	I had good luck rooting my Galaxy Nexus using [ this guide ] ( <URL> I don't have any experience with the method you are using , sorry .	NOT
1026	funny	We are the smarter , more conservative 4chan ' s older brother .	NOT
1027	fatpeoplehate	Yes , fatlogic is a dreadful , disgusting sub . Keep that shit out of here .	EXP
1028	mw3	<NUMBER> kills with killstreaks disabled , you can get it in drop zone .	NOT
1029	starcraft	You do realize he's simply referencing Family Guy ? <URL> ( this comment does not necessarily reflect my views on Family Guy )	NOT
1030	SteamGameSwap	Virtua Tennis <NUMBER> ?	NOT
1031	milliondollarextreme	pretty much anything by andy dick : ) makes me relate too , theres no way a woman should be attracted to me w all those big strong guys out there but somehow they find my lousy personality charming <NUMBER>	EXP
1032	Android	He posted about it way back when development first started , so I got in then . When news broke that Baconreader is going to be developed by OneLouder ( the people that make FriendCaster and TweetCaster ) , I know that thegloriousday ( Reddionic dev ) got pumped cause he knew he'd have to compete with a development team now .	NOT
1033	fatpeoplehate	Size <NUMBER> / <NUMBER> women are more oppressed than fat people tbh . BECAUSE you can mock them about their size in public to her face with no condemnation AT ALL and the thin woman is expected to laugh but if you mock a fat person to her face you are told how mean / hateful / rude you are . I am a bad person and have done both . No one pitys the <NUMBER> / <NUMBER> no matter what happens to them .	EXP
1034	gaming	Just posted there a moment ago as well . ( Initially thought they were just for movies for some reason ) Thanks for the suggestion though .	NOT
1035	fffffffuuuuuuuuuuuu	EVERYTHING ON THE INTERNET IS TRUE DON'T LET ANYONE TELL YOU OTHERWISE	NOT
1036	fatpeoplehate	I'm from East Tennessee . I'd estimate <NUMBER> % of the people are see are overweight , and I can literally go nowhere without seeing at least one of those grotesque , morbidly obese , sacks of fat that waddle or scooter around . Yes , there are healthy and fit people , but the only time I see us outweighing teehee the fatties is at my university's gym . Everywhere public I go I'm weaving in and out of fatties .	EXP
1037	Lubbock	I'm down to go there . We should probably pick a bar to determine closest pregame destination ...	NOT
1038	macgaming	32bit or 64bit Windows <NUMBER> ? If I recall correctly , Snow Leopard drivers don't work with 64bit W7 . If you can find the Lion drivers they might work . If it's 32bit W7 , then the problem is something else .	NOT
1039	santarosa	Taxi ' s A-C Taxi : <NUMBER> - <NUMBER> or <NUMBER> - <NUMBER> . Your driver might be a redditor who gives deals to other redditors . Or take your chances with sketchy old yeller <NUMBER> - <NUMBER> .	NOT
1040	politics	I'd need to see a vote before I took that accountability on . I ; m willing to be one of the ambassadors of reddit , as long as at least fifty others and one narwhal are chosen also .	NOT
1041	milliondollarextreme	I feel like political cartoons were way better back in the day . Now they're really gross and not creative at all	EXP
1042	nursing	Don't do it . Too crowded . Seats taken . Taken . Ya can't sit heeea .	NOT
1043	DoesAnybodyElse	My friends and I had our own forum , it was originally used to make lists like greatest songs of all time and such , but mostly ended up being us rating girls and having votes on who's hotter .	NOT
1044	AskReddit	I have to admit a weakness for formalwear undone . A tux with the bow tie untied , for example . But in terms of actual people , not in movies ? Jeans and a witty t-shirt seems to work really well for me .	NOT
1045	fitnesscirclejerk	What does that even mean xchat is cross platform	NOT
1046	milliondollarextreme	nice argument my dude , don't procreate please .	IMP
1047	politics	Gross .	NOT
1048	fatpeoplehate	They could do that , but it's just too hard ! Christ , what type of person do you have to be to just give up on yourself life that and become comfortable with taking a shit in your shower	EXP
1049	mexico	Callense todos , los tazos y los tamales son de mexico que no saben nada ?	NOT
1050	fatpeoplehate	He doesn't have money . His parents have money . This fat slob hasn't accomplished shit ( right ? )	EXP
1051	AdviceAnimals	Just to be clear , if I'm doing insert exercise that is not squats here in the squat rack , and the proper equipment is in use ( hence my use of the squat rack ) , you can kindly wait your turn , or work between my sets .	NOT
1052	milliondollarextreme	i need a sfw version i've seen somuch but this holy shit this was too much i couldn't even get to the comments before clicking out	EXP
1053	fatpeoplehate	He came here , posted a comment and got banned in a second . <URL>	IMP
1054	IAmA	I think I am smart enough to draw such conclusions myself ... Egypt might like to keep people dumb and not think for themselves but I think I've outgrown that by now ..	NOT
1055	fatpeoplehate	And I think a long long hot shower with a brillo pad is needed .	IMP
1056	gaming	No they can if you are cheating . Well could ... and steam does sometimes screw people but a lot less than EA .	NOT
1057	fatpeoplehate	Wow , fatty is so big and tough . Shit talking to a little kid . Must be hard to be such a pathetic little queef .	EXP
1058	fatpeoplehate	I remember my dad telling me about how some people's lives peak in high school . That shit is so true . Life has a way of dick punching some .	EXP
1059	trees	Just you two ?	NOT
1060	uncensorednews	It's a trade off . The stronger the voter Id laws the more legitimate voters will be excluded in order to get rid of illegitimate voters .	IMP
1061	politics	KANG <NUMBER> !	NOT
1062	fffffffuuuuuuuuuuuu	It was his seat ...	NOT
1063	SteamTrade	post or pm me ur steam id	NOT
1064	politics	I'm not saying he is . I'm simply trying to point out that even if he hated this thing in its entirety , he was still powerless to stop it . I personally believe him when he said he was opposed to large swaths of this bill . The cynic in me thinks this because he knows that even if he wins in <NUMBER> , the Dems are likely to lose in <NUMBER> and then there'll be a Republican of unknown character sitting on the power he was just given .	NOT
1065	milliondollarextreme	I would kinda be happier if the show got cancelled , that means more work on the game , more boox ( ? ) and more events like how i survived high school as well as totally new ideas	IMP
1066	sjwhate	"I'm sorry , but I don't feel one lick of remorse for Muslim women who live and reside in the United States and other 1st world nations . Women who are citizens of these countries have all the rights and privileges as men , and they are choosing to take part in a religion which STRIPS THEM OF THESE RIGHTS AND PRIVLEGES . They are , quite literally , signing up to be treated like property . They can freely dismiss this ideology whenever they want , but choose to be oppressed anyway . Then , after all this , they have the nerve to fabricate attacks from white Christians , who couldn't give a flying fuck about their stupid pedophile god . "" OMG I GOT ATTACKED CAUSE I WAS MUSLIM ? ? "" ' Really ? ' "" Well , no , but I am raising awareness because it could theoretically happen ? ' Oh , well , that doesn't make much sense at all . Say , why do you have that black eye and swollen jaw ? ' "" My dad caught me talking to a jewish boy and he says jews are the scum of the earth since they don't worship allah and , and then he beat me for a few minutes for coming home after curfew "" ' OMG that sounds awful are you ok , should we call the police or ... ' "" OMG SHITLORD , STOP APPROPRIATING MY CULTURE THIS IS JUST HOW WE DO THINGS . "" As I said , I have zero remorse for these people . They choose this lifestyle of oppression , then fabricate claims of other people harming them , cause ' muh narrative ' . Fuck that ."	EXP
1067	uncensorednews	I was so confused by all of these comments until I noticed what sub this is	IMP
1068	fatpeoplehate	I would love separate queues for fat people on amusement park rides . It would have drastically reduced my wait time the last time I went to Orlando	IMP
1069	fatpeoplehate	Yeah , she's basically immobile ( unless it suits her to do something ) . This , and most things pertaining to me , don't suit her so there we are . We live a good <NUMBER> hours apart , but we didn't see much of each other when we lived <NUMBER> minutes apart . She never saw my house , she's met my husband twice ( been together <NUMBER> years ) , and couldn't manage to be arsed to sit up in her bed long enough to see me before I moved out of state . Then she carries on about how she misses me . So yeah . Fat fucks with your entire life and everyone in it .	EXP
1070	fatpeoplehate	Maybe it's a european thing , but here you don't really have to reject any girls . Just answer like <NUMBER> of their questions normally and then they get insecure and stop talking .	IMP
1071	IAmA	Didn't you see American Psycho ? Sociopaths ( and psychopaths while we're at it ) are handsome , charming , intelligent , and very coherent , even when they say things like : Well , don't just stare at it , eat it ! That's a very fine chardonnay you're drinking . I want you to clean your vagina . You're a fucking ugly bitch . I want to stab you to death , and then play around with your blood . But still ..	NOT
1072	gonewild	So adorable . :)	NOT
1073	fffffffuuuuuuuuuuuu	The most appropriate use of this I've seen .	NOT
1074	milliondollarextreme	Sam I think you hit a different target than you were aiming for . The guy isn't a pansy because he works at Buzzfeed and went to grad school , it's because he is doing a bad job and doesn't care , and on top of that is totally dismissive of the people who don't do the same little mild , PC song and dance that he is trying to impose on you . He's hiding behind his brittle facade , stubbornly clinging to lowball , colorless ( but extremely loaded ) questions like ' how do you source your material ' and is unwilling to go deeper than . He has some air of enlightenment and superiority and acts really smug and condescending . ( i can't tell whether or not people like this are even conscious of what they're doing ) But on the other hand you telling him that he's ' never going to achieve his dream of becoming a reporter ' or whatever , sounds like you're trying to uphold some meritocracy where everyone's dream is to become rich , glamorous and famous . The stuff he's doing in the first paragraph is way worse than the fact that he is working at Buzzfeed and got a crap degree . Congrats u just made the hitlist of another numale .	EXP
1075	fatpeoplehate	It's just a bonus that she has a horses ' mouth . A huge bonus . ba dum tss .	IMP
1076	fatpeoplehate	this is why childhood obesity is a terrible terrible thing .	IMP
1077	milliondollarextreme	Not the sappy free-spirit shit , I mean the misanthropic cynical stuff - his insights into the way people percieve each other . Sam probably rejects his conclusions , but I think he definitely absorbed some of his worldview .	EXP
1078	tattoos	nice to see this progress !	NOT
1079	funny	... in ocean on an organic spaceship flying through the universe with all the other talking monkeys .	NOT
1080	fatpeoplehate	I swear that's where she shoves her wallet . A fupa pouch .	IMP
1081	fatpeoplehate	Dat life insurance money .	IMP
1082	sjwhate	Women are seen on-screen more than men only in one film genre : horror I think they have officially run out of things to complain about and now they are just grasping at straws .	IMP
1083	fatpeoplehate	Like every great mountain that's a bitch to climb , I'm sure there are some scattered dead bodies to assist you with this endeavor .	EXP
1084	TwoXChromosomes	Sorry for the confusion . No , he already went to jail and is not allowed any contact with me . It is just too emotional to be out in public for me . I get very upset when people start staring at my eye and it's hard to be around friends because they also get very upset seeing what has happened .	NOT
1085	PS3	FYI if you can't wait for shipping I got my adapter at target , friend got his at Walmart !	NOT
1086	politics	No , but I'm ready to have unattractive service women point at my crotch for pictures .	NOT
1087	Seattle	there are a lot of sticky rules to being an actual corporation , and if you don't follow all of them to the T , then in court you will be ruled as a sole prop , and lose all of the protections you thought you had as an LLC . You can't just file LLC ( or S or C or any other corp ) and say ' I am safe ' . If you are doing enough business that your personal assets are at risk , then seek the advice of a lawyer , and not the professionals on reddit .	NOT
1088	hiphopheads	Cant wait for Nas.Com	NOT
1089	IAmA	One theory is that pica is caused by a deficiency in vitamins / minerals / nutrients . What type of food do you normally eat ? Do you take a daily multivitamin ? Have to had bloodwork done to check for anemia ( which can be related to iron deficiency ) ?	NOT
1090	TheoryOfReddit	I mean , no one subreddit has the entire population of Reddit on it , This is the problem . There should be a platform that can reach almost all of reddit when necessary . / r / reddit.com was the platform . Self and misc are not even remotely close to capable of filling this role at this point .	NOT
1091	fatpeoplehate	"These types of comments always remind me of that James Bond scene . "" You expect me to talk ? "" "" No , Monsieur BonBon , I expect you to die """	IMP
1092	NoFap	Agreeing to disagree is fine by me . Still , congratulations !	NOT
1093	funny	Level Up ! Haha , yes CN is a fat fucking child .	NOT
1094	nba	Im still laughing .	NOT
1095	AskReddit	Okay , fair enough . On that note , aren't you a greedy asshole for wasting your time on Reddit when you could be out volunteering in a soup kitchen or something ?	NOT
1096	fatpeoplehate	She couldve given her excess bodyweight in calories to starving people all around the world	IMP
1097	fatpeoplehate	I can't read what this paragraph says , I don't speak fat fucking retard .	EXP
1098	SuicideWatch	Trapped . Lonely , but mostly trapped .	NOT
1099	fatpeoplehate	Exactly , can we make that clear in the sidebar ? It seems many subscribers don't understand that .	IMP
1100	circlejerk	You are doing God's work my friend . Have an upvote !	NOT
1101	videos	Ahh , the three G's of westward expansion ; God , Glory , and booGers .	NOT
1102	politics	coming from a guy who supported the Iraq War ...	NOT
1103	fatpeoplehate	OMG this fat bitch again ? She's killed herself like three times this week .	EXP
1104	IAmA	you were hooking up with your boss ? please continue	NOT
1105	trees	I bought the last pack today and will finish it by midnight .	NOT
1106	uncensorednews	White women are destroying Western civilization .	IMP
1107	uncensorednews	Sure has . They're using the exact same tactics they use in r / politics . Flooding comment sections with idiotic straw man or ad hominem arguments , muddying the waters etc . They haven't started thread sliding like in r / politics but I'm sure that will happen if this one ever gets too much traction .	EXP
1108	gaming	Then he doesn't mean that one , does he .	NOT
1109	MachinePorn	Mirror-image turbos - - awesome attention to detail .	NOT
1110	drunk	Taste like vanilla dr pepper	NOT
1111	fatpeoplehate	Thin privilege is looking great without effort .	IMP
1112	sjwhate	LOL	IMP
1113	milliondollarextreme	You got <NUMBER> seconds to show me that hole bitch	EXP
1114	gonewild	So do I . Oh , well - there are always dreams .	NOT
1115	Watches	Just because it's a fake doesn't mean it's not worth anything as a watch . It works great , and keeps good time . Looks fairly good as well . It may not be worth anything as a Rolex , but it's still a fair watch .	NOT
1116	fatpeoplehate	this lump o lard is horror movie scary .. look at that huge head .. If her head is that big her body has got to be gigantic ...	EXP
1117	fatpeoplehate	"OBeast's body language translation ( neck waddle prevents actual words from forming , luckily SCIENCE discovered the Obeasetta Stone ): "" MEN OF REDDIT — GET IN MAH BELLY SO I CAN DEVOUR YOUR MAN JUICE , YOUR THINNESS , AND YOUR SOULS . I MUST SPREAD THE FALSE TEACHINGS OF FAT ACCEPTANCE . "" Those FattyFatFuckEnablers should also be publicly shamed and ridiculed for falesly raising her confidence because now she is going to go out and eat another box of MoonPies slathered in peanut butter to celebrate her Obeastlisexiness — because one time she overheard a 6PackShitLord mention he loved PeanutButter and includes it in his protein shakes and she does the same now because HEAS — and then strike again but with a slightly larger FUPA that encroaches even further on her ObeastlyBits ."	IMP
1118	fatpeoplehate	Here is a reply from one of her sympathizers : Well , leaving it would just be a CRIME . Sopping up the last bit of yolk with your whole wheat , lightly-margarined toast is the highlight of the morning , perhaps only taking second to drinking the last dregs of your coffee at the bottom of the mug , where the artificial sweetener and powdered creamer that couldn't disolve all sunk to , making that last sip extra sweet and satisfying .	IMP
1119	leagueoflegends	I have not been proven wrong , everyone glosses over what I wrote even though it's completely valid . The last sentence is merely opinion , but everything else is the truth . Good on you though for contributing nothing .	NOT
1120	AdviceAnimals	Wait a second . Are you the real UkrainianLimbs ?	NOT
1121	milliondollarextreme	Think back to Sam's baby standup about Bernie bros and this becomes even more funny	IMP
1123	writing	I'm more than Ok with that .	NOT
1124	milliondollarextreme	Is this book about being kangz and shiet ?	IMP
1125	gaming	But they are still what $ <NUMBER> when they came out and they have a shorter campaign and no MP ?	NOT
1126	politics	"The text not in bold are Ron Paul's own words unedited . Ron Paul - Bill of rights <URL> If anything , the Supreme Court should have refused to hear the Kelo case on the grounds that the 5th amendment does not apply to states . If constitutional purists hope to maintain credibility , we must reject the phony incorporation doctrine in all cases — not only when it serves our interests . The issue in the Kelo case is the legality of the eminent domain action under Connecticut law , not federal law . Congress can and should act to prevent the federal government from seizing private property , but the fight against local eminent domain actions must take place at the local level . The people of New London , Connecticut could start by removing from office the local officials who created the problem in the first place . Ron Paul lying about the Constitution The Founding Fathers envisioned a robustly Christian yet religiously tolerant America , with churches serving as vital institutions that would eclipse the state in importance . Throughout our nation's history , churches have done what no government can ever do , namely teach morality and civility . Moral and civil individuals are largely governed by their own sense of right and wrong , and hence have little need for external government . This is the real reason the collectivist Left hates religion : Churches as institutions compete with the state for the people's allegiance , and many devout people put their faith in God before their faith in the state . Knowing this , the secularists wage an ongoing war against religion , chipping away bit by bit at our nation's Christian heritage . Christmas itself may soon be a casualty of that war . "" The notion of a rigid separation between church and state has no basis in either the text of the Constitution or the writings of our Founding Fathers . On the contrary , our Founders ' political views were strongly informed by their religious beliefs . Certainly the drafters of the Declaration of Independence and the Constitution , both replete with references to God , would be aghast at the federal government's hostility to religion . "" Ron Paul on sexual harassment "" Employee rights are said to be valid when employers pressure employees into sexual activity , "" Paul wrote . "" Why don't they quit once the so-called harassment starts ? Obviously the morals of the harasser cannot be defended , but how can the harassee escape some responsibility for the problem ? Seeking protection under civil rights legislation is hardly acceptable . "" Ron Paul - We the people act The We the People Act forbids federal courts , including the Supreme Court , from adjudicating cases concerning State laws and polices relating to religious liberties or "" privacy , "" including cases involving sexual practices , sexual orientation or reproduction . The We the People Act also protects the traditional definition of marriage from judicial activism by ensuring the Supreme Court cannot abuse the equal protection clause to redefine marriage . In order to hold Federal judges accountable for abusing their powers , the act also provides that a judge who violates the act's limitations on judicial power shall either be impeached by Congress or removed by the President , according to rules established by the Congress ."	NOT
1127	Music	Do artist's really need to dick ride Hendrix in <NUMBER> ? I mean he's great and all but can't we just put the praise in the ' To obvious - it's been done ' category and try to discuss more meaningful or at least topical things in music ?	NOT
1128	fatpeoplehate	I've always wondered how her food tastes . Like she uses so much shit that is fattening , I just assume it has to taste good . Then I see her randomly drop in a jar of mayo in something and I'm like well maybe not .	EXP
1129	skyrim	Casting anything other brings it down , so there's still some practicality there .	NOT
1130	fatpeoplehate	I don't understand funnel cakes . I tried to eat some of it at a fair a while ago and nearly threw up . Its literally a pile of grease .	IMP
1131	uncensorednews	So there were <NUMBER> non citizens who registered out of <NUMBER> . <NUMBER> million registered to vote . That is a <NUMBER> . <NUMBER> % error rate with the current system . You are going to get rid of many more legitimate voters with a voter ID law .	EXP
1132	milliondollarextreme	hahahahaha !	IMP
1133	politics	Yes , especially if there is a good argument that it is in violation of the Constitution .	NOT
1134	SteamTrade	Want Left <NUMBER> Dead GOTY , <NUMBER> coal ?	NOT
1135	milliondollarextreme	There is only one god Allah praise be unto him : index_pointing_up_medium-dark_skin_tone :	IMP
1136	fatpeoplehate	Both actually . I've seen the movie multiple times and read the book . Absolutely love it .	IMP
1137	uncensorednews	How cute , the golem insist they are people .	IMP
1138	wow	From what I see of rift , they have lots of end game content , and some of the hardest fights in any MMO .	NOT
1139	milliondollarextreme	honestly the gril im fucking right now goes to church all the time but shes still a sorority whore	EXP
1140	battlefield3	I tend to C4 them nowdays , RPGing them is just takes too long , and if there is a gunner in the thing , you'll be lucky to get off a second one .	NOT
1141	uncensorednews	And Christianity was loaded with incest and rape . All religions are sick . Some of just advanced past brutality .	EXP
1142	politics	Uhm . <NUMBER> ( e ) inserted on Dec 15th ( IIRC ) specifically addresses ... Sigh , nevermind .	NOT
1143	fatpeoplehate	She has a youtube channel where she admitted that she has a binge eating disorder and goes for help . I would feel sympathetic , but she also promotes a lot of HAES crap which encourages other girls to be fat like her . No , you've admitted that it's a problem . Don't tell others to be like you .	EXP
1144	magicTCG	wtf , <NUMBER> downvotes ;[	NOT
