	subreddit	text	labels
2887	mylittlepony	"I'm just going to say that there are no "" real bronies "" . If you identify yourself as a brony , you're a brony , and you're on the same level as all the other bronies . And yeah , I agree completely , do what you want to do but don't feel like you're required to because of the fandom ."	NOT
2888	fatpeoplehate	Read MY posts , you can't deny ANYONE from church . Get your head out of your ass .	EXP
2889	fatpeoplehate	Well it's not like this fat fuck is going to stalk his prey , following the lion's tracks through a dense scrub using nothing but his wit and athleticism . He likely needs a scooter to get down the isle at a grocery store .	EXP
2890	fatpeoplehate	if we assume she isn't lying about her height and weight , she is at <NUMBER> BMI , which is technically not overweight . so i am not sure if this was a rightful ban ? i am not comfortable guessing her weight from that picture so i'm not going to say more .	EXP
2891	milliondollarextreme	this is so great . RIP Swann	IMP
2892	sjwhate	If the choices are to fuck up my child or stop it I would stop it . And than fix the insurance later . Sometimes right is hard to do . Chop up boobies and drugs or no one pays for it and child doesn't get shit done .. fix insurance later . Or leave a damn will .	EXP
2893	sjwhate	"i don't know if it's "" sjw content confirmed "" , but it's funny as hell have an upvote for making me laugh my ass off "" OHHH It BURNS """	EXP
2894	WTF	I thought i was gonna see a dead deer dressed up like Rudolph . Phew .	NOT
2895	newyear	varg_18@hotmail.com	NOT
2896	milliondollarextreme	Clearly the kids are sexually active them . That's not normally the tradition though . By the way childhood obesity , and being islamic are a far cry from being comparable to giving <NUMBER> year olds estrogen therapy .	IMP
2897	battlefield3	"Having "" tactics and teamwork "" occur on a <NUMBER> - player server is completely different from having a 32v32 competitive match . I played a ton of PR , I loved it , but it is an entirely different ball game . 64v64 PR is like doing military re-enactments . 8v8 BF3 is like playing a football game ."	NOT
2898	fatpeoplehate	I picture a ham trying to sabotage someone's food , but then succumbing to temptation and eating the wayward calories	EXP
2899	mw3	What do you have to do ?	NOT
2900	fatpeoplehate	"Army veteran here . Can confirm : fit soldiers for some reason settle for fatties . Probably something to do with the male / female ratio . Fat white girls are in paradise if they live in the hood , or near a military base . Obviously the guy here isn't fit though , which leads us back to my "" in the hood "" theory ."	IMP
2901	vegan	I came for the beers .	NOT
2902	uncensorednews	People cry the same bullshit EVERYTIME there is a refugee crisis . Show me what special budget cuts happened in order to reallocate the funds to specifically help refugees There's always a budget for situations like this , regardless of its happening or not	EXP
2903	fatpeoplehate	If the photos are on your phone you can select them from wherever they are stored , you can then select as many as you want .	IMP
2904	AskReddit	What ? No .	NOT
2905	fatpeoplehate	Jesus Christ , what the fuck is their problem ?	EXP
2906	sjwhate	I'm pretty sure they were removed . Yeah I'm like you , I ; m not involved with or sympathetic to either of those topics but don't break the law with your protests , it doesn't make any logical person sympathetic to your cause . BLM has pissed off more people than they have attracted with their antics of shutting down traffic and other actions that break laws . Speaking of BLM , they have actually opened up my eyes to the black on black violence epidemic , how police are actually more hesitant to shoot black people and how more whites are shot by police officers .	EXP
2907	fatpeoplehate	<NUMBER> . Tatted-up whale with orange hair posing in front of junk food . <NUMBER> . Complains that it can't go to gym because then it wouldn't be able to afford food delivery . <NUMBER> . Lives off of government assistance . Seems too offensive to be true . Probably just The National Review stirring up rage for clicks . The real story is that a low-grade reporter needed a photo for a non-story , so they went and found a fatty with a repulsive face to stand in front of junk food . It probably accepted the junk food as payment .	EXP
2908	milliondollarextreme	Tyler has dropped references to World Peace before . Is he still banned from Australia ?	IMP
2909	milliondollarextreme	You are the definition of a useful idiot . Explaining anything to you would be a Sisyphean endeavor . If you want to become less of an idiot I strongly suggest you read Revolt Against The Modern World .	EXP
2910	audioinsurrection	This and mischief brew all in one day ? Score	NOT
2911	uncensorednews	<NUMBER> that time . I'm using your idiocy as a RNG . Hurry up , Dave needs to roll for damage .	EXP
2912	AskReddit	My boyfriend , and maybe some other randoms .	NOT
2913	politics	remember this piece of shit never had the authority to grant or take away our rights just as every other politician never could do anything but make our lives worse not better . Only PEOPLE working together as diverse individuals with the common goal of being in a free and equal society can change things , never the State because it is NOT us and it never has and never will actually represent the people that it claims to .	NOT
2914	AskReddit	"Reminded me of "" one titty's bigger than the other so I call her Biggie Smalls """	NOT
2915	SteamTrade	I have a ton of coupons , please look : <URL> Also , I could buy a game for you ( maybE ) I dont want dota <NUMBER> , only valve complete	NOT
2916	fatpeoplehate	"I don't think the gay guys have that same problem . its called catfishing , I ran into a couple of time where neckbeards would put fit guys on their profile pictures , then when their discovered complain that the gay community is "" unfair "" to big guys . Then I had a couple of times where fat guys would force themselves , literally , on me because they thought I was "" interested "" in them when I was trying to make small talk and run away . I would rather deal with a fat girl who gets angry because I turned her down due to her whale-like body than have a disgusting grease ball try to climb on me just to make absolutely sure I wasn't into him ."	EXP
2917	runescape	Congratulations ! Herblore is my favourite skill . It's a shame it's so expensive nowadays to train .	NOT
2918	uncensorednews	That's funny .	IMP
2919	Android	What features does it have that the Android reddit apps lack ? Or is it just the fluidity of it ? I'm using Reddit News primarily but I still go back to RiF for better subreddit access / searching and some inbox access . Reddit News is almost there and I'm hopeful the dev keeps it up .	NOT
2920	worldnews	When I'm making two sufficiently distinct points , I like to make two posts , in case readers believe that one point is valid and worthwhile , but the other isn't . That way they can upvote one and / or downvote the other , without facing any dilemma .	NOT
2921	milliondollarextreme	Hey Buddy , that's a Film degree from the Rhode Island School of Design . BIG DIFFERENCE K , SWEETIE ? ?	IMP
2922	magicTCG	I liked your recaps , they did a good job of recapping the action . I would recommend making a tappedout account or at least fixing the spacing to improving readability . How often do you run into color screw ?	NOT
2923	fatpeoplehate	"I love that she put "" yyz "" as if she could fit in a plane seat without suffocating the people next to her ."	IMP
2924	SOPA	"The one lesson we need to learn from all of this is that our government is DEEPLY in bed with corporate interests ... For the sake of discussion , allow me to disagree with you . I think a better lesson is that politicians can not understand the implications of what they do , nor be informed enough about every person in the country , let alone the world , to plan their lives for them . Their excuse is that they are trying to "" save "" jobs . If they really were looking out for every American they would be trying to get as much information as possible from the people that would have the most / best information on the subject . It is entirely possible that they are doing exactly that and it isn't so much that they are "" in bed with corporate interests "" , but that what we are seeing is the side effect of entrusting them with an impossible task . On the extreme , lets not worry so much about who is getting to decide which books go into the bon fire and start making it clear that we are against book burning ."	NOT
2925	europeannationalism	I don't think you are most of Poland , and you seem to be talking nonsense .	EXP
2926	AskReddit	True Stories	NOT
2927	AskReddit	My <NUMBER> year old musically inclined daughter had a name for her fake band in the early <NUMBER> ' s ... The Sassy Cats . Still tease her about it now .	NOT
2928	uncensorednews	You do realize that / r / The_Donald is a <NUMBER> % pro Trump sub , right ? We celebrate Trump there <NUMBER> / <NUMBER> . It's all about himself and his politics . This fact is made crystal clear in the sidebar . Of course it's going to be one sided . Just like a music sub , is going to <NUMBER> % be all about music or a certain artist . Why would i go to a Green Day sub , and want to talk ill of them , or talk about another band ? To have an ' alternative view ' as you suggest ? But it's more than that . You have to tow the narrative or get deleted or banned . I didn't say you have to post something anti-Trump to get banned . If you go in there and post proof that something is categorically incorrect your comments will be gone in minutes and the thread will continue on with thousands of upvotes and hundreds of comments affirming that it's true . It is being used to manipulate Trump supporters exactly as they are screaming the MSM is doing against Trump . No one but the establishment wins in this scenario .	IMP
2929	milliondollarextreme	It would be cool getting C U M hats for your whole group of friends to wear when going to the club .	IMP
2930	fatpeoplehate	This ham is nearing its final form . It's grown a mouth in it's stomach and turned to cannibalism as nourishment .	EXP
2931	milliondollarextreme	First off , quit being an autistic faggot and assuming i'm a hillary supporter . also , it's not a load of shit , there were litterally people giving out personal info of guys who were allegedly involved . anybody who looked at the subreddit long enough could tell . Also <URL>	EXP
2932	SteamGameSwap	Come on .	NOT
2933	videos	And figuring out how to keep the kids from going outside or looking through the windows . :(	NOT
2934	fatpeoplehate	If I put in the time and effort , I could be an astronaut . So cool , too bad I'm just gonna think about it and whine on social media about how it's a dream bc im a lazy fucking slob ...	EXP
2935	AskReddit	and time the finish with the ball drop	NOT
2936	milliondollarextreme	quick question , <URL> is this fake news or what ? what do you think of this , i don't remember pro trump memers addressing that issue , not that i paid too close attention since i don't have a horse in that race except for the environment issues and they both suck very hard at that level so ... anyway what is the general take on trump and privacy ? seems he don't care for yours .	EXP
2937	milliondollarextreme	"hey that reminds me , i always wondered how it was supposed to work out with the whole "" every single child of every parent is expected to buy their own house "" thing . Always puzzled me as a kid , seemed kinda unsustainable . You figure if a couple raised a family of <NUMBER> - <NUMBER> kids and every one of those kids bought their own house and had <NUMBER> - <NUMBER> kids of their own , would there not be enough room at some point ? Seems like if everyone had <NUMBER> - <NUMBER> grandsons with <NUMBER> - <NUMBER> houses , cities would be bumping in to each other by now ."	IMP
2938	milliondollarextreme	[ removed ]	IMP
2939	trees	Classic hand rolled joint	NOT
2940	funny	When 4chan hits one out of the stadium , it's great ; however , most of the time 4chan is about as enjoyable as a wade through the fetid and turbid waters of / new / . At least on reddit the garbage can be downvoted .	NOT
2941	Metal	Cynic - [ Box Up My Bones ] ( <URL>	NOT
2942	fatpeoplehate	"LOL , didn't claim to be a doctor , just a nerd ( going into medical school actually ) . Not trying to convince anyone to take what I said with anything more than a grain of salt but I was in and out of hospitals for the same condition I think this woman has for almost a year and done my share of research ( you would too if you were in as much pain as I was ) so I am fairly informed about it . Not hard to recognize when someone's "" fat "" is rock hard and defying gravity . She should of course see an actual doctor and maybe do some testing to confirm but I don't think she should rule it out . If she wants to work out and tone up she will probably make more progress once she treats any potential digestive issues . Speaking from experience ."	EXP
2943	DebateAChristian	Really ? Merriam-Websters dictionary is what you filter theological ideas through ? I don't have any theological ideas seeing that I don't believe in theology ( being an atheist and all ) . However , when I need to debate the definition or meaning of a word , I find Merriam Webster a good source to reference . If you'll look closely , there are three definitions given for magic . I'm referring to definition <NUMBER> . <NUMBER> a : an extraordinary power or influence seemingly from a supernatural source I find this an adequate definition of how christians describe the powers of Yahweh . Not a strawman . As for the zombie bit , if you were intellectually honest you'd admit that the ' full likeness ' claim is the ONLY thing your argument has going for it .	NOT
2944	gatech	Actually that Scully dude looked pretty good . I realize he missed a FG , but it was <NUMBER> yards and it was close ... and he was WAAAYYY better on kickoffs then whoever else was doing that all year .	NOT
2945	Aquariums	""" I'm poopin ' in mah cave """	NOT
2946	fatpeoplehate	""" Missing piercings "" ? Put your glasses on , my friend and look again . Her location of piercings made me want to throw up a little ."	IMP
2947	fffffffuuuuuuuuuuuu	Well in skyrim there are dragons therefore dragons are real , Bethesda would not lie to me	NOT
2948	sjwhate	To be fair , there were hundreds of thousands of people out protesting . I'm not sure what the correct solution is . Police roughing up people would only lead to more protests	EXP
2949	fatpeoplehate	Dang dude your ankle is swollen , oh thats normal for you ?	IMP
2950	milliondollarextreme	As long as it doesn't affect your grades you should be fine	IMP
2951	homestuck	"To quote Hussie from the notes in Homestuck : Book <NUMBER> : "" I think a lot of readers have been disappointed that John's peanut allergy never had significant consequences in the story later . Still , as of writing this note , the story isn't finished , so ... """	NOT
2952	fatpeoplehate	Video games for one . So many people associate video games with gross lazy fat people I usually don't tell people anymore because it makes them immediately look down on you , even if you're in shape . Anime too .	EXP
2953	NoFap	god damn count me in . The first time i did it , i went for say <NUMBER> days or so idk , but everything in my life improved . right now im at the lowest of the low ... life sucks right now . Im hoping this will bring me out of the hole im in .	NOT
2954	milliondollarextreme	If the wage gap was real men would be out of work and companies would only hire women , You fat dumb piece of shit .	EXP
2955	uncensorednews	"Seriously , they need to bus these kinds of students to every snobby East / West liberal white / asian majority school district . Snobby liberal white / azns love to talk shit about "" raycist "" white southerners and "" white trash "" ."	EXP
2956	Minecraft	Too bad you can only see half of it !	NOT
2957	milliondollarextreme	[ Euro Truck Simulator <NUMBER> : Calais Gauntlet ] ( <URL> What in God's cock is going on here ? !	EXP
2958	fatpeoplehate	""" Just to please me "" wtf are you on about ?"	IMP
2959	leagueoflegends	Simplest answer is get boots fast .	NOT
2960	uncensorednews	okay McCarthy	IMP
2961	sjwhate	The inmates are running the asylum . The west is so fucked	IMP
2962	fatpeoplehate	Your submission was removed for the following reason ( s ): - It is a recent / common repost . If you feel this removal was in error , please [ message the moderators ] ( <URL>	IMP
2963	Cooking	I have TONS of hummus and guac in my fridge right now . If you happen to be in SF , come on over Party	NOT
2964	skyrim	Nope , my sneak is mid-range .	NOT
2965	milliondollarextreme	Rip the video got taken down	IMP
2966	fffffffuuuuuuuuuuuu	Terminator <NUMBER> theme is now playing in my head on repeat .	NOT
2967	milliondollarextreme	My friend's a big fan of this era and really likes the Anno and Europa Universalis series Also it's still years out and theres been no news since an announcement last year but Amazon Games Studio is working on an MMO called The New World that as of now is supposed to be a player constructed / run world in the vein of EVE with a fictionalized / magical world set in this era . Who knows if it will ever come out though or if it will be anything remotely like that . Plus MMOs are major time wasters if you're not smart about how you approach them	IMP
2968	funny	[ Step <NUMBER> . ] ( <URL>	NOT
2969	leagueoflegends	Kass is a horrible lane against Xerath cause he just pokes you down from outside your silence range .	NOT
2970	skyrim	only if you beat him after doing a good amount of stuff first . for example my first play through i was lvl <NUMBER> when i fought him the last time and he was definitely the hardest dragon i had fought so far . second play through i was like lvl <NUMBER> when i fought him and killed him with like <NUMBER> arrow .	NOT
2971	AskReddit	It's sort of an ongoing thing I'm doing , although I'm keeping it dormant for now , and still trying to be discreet , so I'll but it broadly that using a troll account I provoked an internet religious war that had thousands involved .	NOT
2972	sjwhate	It brings tears to my eye , thinking about all those sjw's crying in their safe spaces .. Tears of joy of course ..	IMP
2973	AdviceAnimals	Ran out of possible moves In solitaire	NOT
2974	IAmA	I know that some pregnant women also have to deal with pica . Do you think your pica could affect your decision to have children ?	NOT
2975	nfl	I'm not sure why they would if the point of the vote was to get someone on the cover that nobody cared was affected by the curse or someone people wanted affected by the curse .	NOT
2976	pics	wow you must be pretty anoying to conterfeat that nice body	NOT
2977	tf2trade	sold already sorry :/	NOT
2978	unitedkingdom	Reeking	NOT
2979	AskReddit	Why ? $ 100M isn't unlimited money .	NOT
2980	milliondollarextreme	<URL>	IMP
2981	Military	My wife takes all my military clothing and throws it in a dump on the bed for me to fold to the standard . I also have a separate closet for my clothing , uniforms , equipment etc . Mixing them with our civilian stuff would just aggravate me too much .	NOT
2982	pics	I like how it draws attention to the stretch marks .	NOT
2983	milliondollarextreme	Sorry hun , Chris is way out of your league .	IMP
2984	fatpeoplehate	And I thought her pictures were bad , only now have I realized how fucking massive she is .	EXP
2985	uncensorednews	It is pretty loony , though . And I've had similar circumstances in my near family .	EXP
2986	fatpeoplehate	I'm sure the cankles make it hard too .	IMP
2987	fatpeoplehate	I don't have any men in my life that I want to ask out . Because of that I was doing the online dating thing for a bit and definitely wasn't shy to message guys . Most of the time the dates were just mediocre OR we'd really like each other and keep going on dates but then they just wanted to be friends with benefits OR they'd get back with their ex OR they'd move to another state , etc etc etc . Tldr : Not that easy . Dumb shit happens .	EXP
2988	bisexual	"Asexuality isn't just black and white , like lots of things . Asexual , except when it comes to fantasies , where you are bisexual ? I think you fit in the "" Grey-A "" category . <URL>"	NOT
2989	videos	SWEET BERRY WINE !	NOT
2990	milliondollarextreme	He weighs so much it's damn near impossible to . He's actually been losing about as much as he can .	EXP
2991	AskReddit	Hugh Jackman .	NOT
2992	Buddhism	I'd love to see a full size version of this .	NOT
2993	starcraft	If I can get enough people from my team to go . We've lost a few of our players with the end of this last semester .	NOT
2994	fffffffuuuuuuuuuuuu	then i find out she has sex with strangers . Every . Damn . Night . Was she in a relationship ? If not , then what's your point ?	NOT
2995	AskReddit	I'd live in Northern California once but leave before it made me soft . As someone from the east coast who currently lives in northern California I laughed . I've heard this before , and it's true . Very true . I'm due to move back to New England sometime in the next few years .	NOT
2996	Android	First I tried the new stock <NUMBER> . <NUMBER> . <NUMBER> , battery was fine ( I have the T-Mobile USA variant ) , but I couldn't charge apps to my carrier bill . I switched to KalimochoAz's CM9 Alpha and I'm loving it . No battery headaches , the comforts of carrier billing , etc .	NOT
2997	uncensorednews	"Who the hell wakes up in the morning and is like "" I'm going to wear that out in public today "" ?"	IMP
2998	uncensorednews	lol The balls on these mother fuckers to call others terrorists	IMP
2999	fatpeoplehate	Turns out this was a glorious weight loss story that OP posted backwards .	IMP
3000	fatpeoplehate	I was once called anorexic while I was eating food from fucking Rally's . And it was because I only ordered a small fries and a small soda . Seriously , they're the most delusional creatures .	EXP
3001	fatpeoplehate	Those saying it's not a disease and a choice , are equating the wrong things . Yes they have become obese as a result of choice , negligence , what have you , however they are still diseased . As with most illnesses , treatment and cures are available .	EXP
3002	fatpeoplehate	Yeah , loads of wannabe models get rejected cause we have many pretty girls . You also need to be able to pose and move , not just sit there awkwardly .	EXP
3003	fatpeoplehate	How fucking old are you ? You look like <NUMBER> + doing these stupid fucking panel things . Jesus christ get a life	EXP
3004	fatpeoplehate	I've noticed that fatties only understand that you can either be obese chubby or anorexic . Normal weight does not exist in their mind .	EXP
3005	AdviceAnimals	Normally , the approach there is to encourage the student to ask questions and do your best to answer them in a way that builds understanding . How well this can be managed with <NUMBER> + students in each class is another matter .	NOT
3006	fatpeoplehate	Well thank god you posted an ad , I've never seen a fat guy ( with a beard ) in my whole life But I've been dreaming and knew this day would come Here's what I know about you from your post . - you're fat - you do not have a Camaro Wow , what a personality ! Seriously , this is the worst ad ever . if the op were fit and wrote about just that , it would still be a turn off .	EXP
3007	darknetplan	But I didn't get you anything . I know , we'll share ! If you liked LEO on the Cheap , the congressional [ Reducing Launch Operation Costs : New Technologies and Practices ] ( <URL> [ Big Dumb Boosters : A Low-Cost Space Transportation Option ? ] ( <URL> [ Affordable Spacecraft : Design and Launch Alternatives ] ( <URL>	NOT
3008	uncensorednews	Possibly even applauded for having the guts to stand up and say it	IMP
3009	fatpeoplehate	"AAAHHH D: D: D: D: god damn , if that's "" body positivity "" then count me out ."	EXP
3010	fatpeoplehate	Oh , I agree completely ! Like I said , I'm perfectly fine with my <NUMBER> ' <NUMBER> ' ' . I wouldn't mind an extra <NUMBER> inches so I could fit in pants correctly or reach the top shelf without having to get on my tippy toes and kinda pull myself up ... but I certainly wouldn't want any more than that . <NUMBER> ' <NUMBER> ' ' on the other hand ... I can't imagine . Everything must be your enemy . Fuck doors , seats , fans , showers , bikes , beds , etc .	IMP
3011	pics	Oh , CRAP ! Whatever . Happy belated Christmas . Jerk .	NOT
3012	fatpeoplehate	"Indeed I do sir . All we need is r / gwcurvy to prove your hypothesis correct . Should we abandon the word "" curvy "" to let the hams have and start using another term or try to take the title back to its rightful owners ?"	IMP
3013	AmISexy	Yup , you're definitely hot . Wouldn't mind more pictures . ;)	NOT
3014	SteamGameSwap	Sorry , its not really my kind of game	NOT
3015	europeannationalism	Business and diplomacy are not so binary - plus the petro-dollar has too much inertia . This is all a show .	IMP
3016	fatpeoplehate	No idea . In your defence , when I quoted you , it showed as wider spacing , but was back to how it appears when I posted .	IMP
3017	milliondollarextreme	SEND THEM THE FUCK BACK HOME	IMP
3018	milliondollarextreme	Everyone in comments getting mad because it's true You all copied sam's writing style and its hilarious	IMP
3019	AskReddit	Her sister walked in .	NOT
3020	hardwareswap	Which chip are you using ? Has it RRODed before ?	NOT
3021	tf2	"Wait , why did you get a "" make a wish "" wish ? also , you tried to sell that hat for shame"	NOT
3022	fatpeoplehate	"It's like "" Operation Dumbo Drop "" except the elephant had an acceptable BMI for its species ."	IMP
